Title,Partner,Subject,Description,Rating,Level,Duration (in hour),Skills,URL
modern contemporary art design specialization,The Museum of Modern Art,Music and Art,explore art idea time develop deeper understanding artist designer process gain confidence looking talking art,4.8,Beginner level,40.0,storytelling journalism cultural diversity architectural design creativity multimedia social justice art history aesthetic innovation electronic medium medium communication,https://www.coursera.org/specializations/modern-contemporary-art-design
chatgpt zapier aipowered email mastery specialization,Vanderbilt University,Business Essentials,chatgptpowered email automation productivity master chatgptdriven workflow automate email task streamline communication organize important information effortlessly zapier,4.8,Beginner level,40.0,creative thinking brainstorming data integration google workspace large language modeling workflow management automation productivity chatgpt prompt engineering organizational skill,https://www.coursera.org/specializations/chatgpt-zapier-email
successful negotiation essential strategy skill,University of Michigan,Business Essentials,successful negotiation essential strategy skill,4.8,Beginner level,40.0,cultural diversity communication mediation conflict management contract negotiation negotiation sale strategy arbitration ethical standard conduct influencing decision making planning,https://www.coursera.org/learn/negotiation-skills
generative ai product owner specialization,IBM,Leadership and Management,power product owner career genai become proficient genai tool week optimize product lifecycle drive result,4.8,Intermediate level,40.0,market intelligence virtual environment stakeholder engagement large language modeling chatgpt openai product requirement ibm cloud prompt engineering image analysis strategic thinking,https://www.coursera.org/specializations/generative-ai-for-product-owners
business financial modeling specialization,University of Pennsylvania,Business Essentials,build business financial model use spreadsheet model make datadriven financial decision,4.5,Beginner level,40.0,risk modeling statistical modeling decision making investment management microsoft powerpoint mathematical modeling microsoft excel google sheet regression analysis financial statement,https://www.coursera.org/specializations/wharton-business-financial-modeling
mathematics machine learning specialization,Imperial College London,Machine Learning,mathematics machine learning learn prerequisite mathematics application data science machine learning,4.6,Beginner level,40.0,machine learning algorithm statistic machine learning calculus derivative artificial neural network numpy applied mathematics advanced mathematics regression analysis,https://www.coursera.org/specializations/mathematics-machine-learning
meta data analyst professional certificate,Meta,Data Analysis,launch career data analytics build jobready skill musthave ai skill indemand career earn credential meta month less degree prior experience required,4.7,Beginner level,200.0,data visualization software exploratory data analysis panda python package bayesian statistic data cleansing sql key performance indicator kpis descriptive statistic,https://www.coursera.org/professional-certificates/meta-data-analyst
bookkeeping basic,Intuit,Business Essentials,course part intuit academy bookkeeping professional certificate,4.6,Beginner level,40.0,income statement accounting software accounting general ledger cash flow ledger accounting accounting record balance sheet financial statement ethical standard conduct bookkeeping,https://www.coursera.org/learn/bookkeeping-basics
microsoft power bi power platform productivity specialization,Microsoft,Software Development,become power bi power platform expert boost productivity automate process gain valuable insight,4.6,Beginner level,160.0,dashboard star schema excel formula microsoft excel microsoft power platform data literacy data transformation data storytelling data modeling data analysis expression dax,https://www.coursera.org/specializations/microsoft-power-bi-and-power-platform-productivity
ai agent agentic ai python powered generative ai specialization,Vanderbilt University,Machine Learning,learn ai agent fundamental ground learn build resilient ai agent develop agentic ai skill python remain relevant despite rapidly evolving ai landscape,4.8,Beginner level,40.0,creative thinking brainstorming large language modeling agentic system productivity chatgpt persona user experience openai prompt engineering transaction processing interoperability,https://www.coursera.org/specializations/ai-agents-python
first step korean,Yonsei University,Other Languages,first step korean,4.9,Beginner level,40.0,grammar culture vocabulary literacy writing language competency,https://www.coursera.org/learn/learn-korean
adobe marketing specialist professional certificate,Adobe,Marketing,launch career marketing build jobready skill digital marketing content development branding social medium,4.8,Beginner level,200.0,advertising crosschannel marketing promotional strategy content marketing campaign management content strategy social medium content creative design marketing effectiveness,https://www.coursera.org/professional-certificates/adobe-marketing-specialist
entrepreneurship specialization,University of Pennsylvania,Entrepreneurship,turn idea funded business develop launch fund grow business,4.8,Beginner level,40.0,growth strategy entrepreneurial finance business valuation due diligence proposal development customer acquisition management sale presentation branding,https://www.coursera.org/specializations/wharton-entrepreneurship
finance quantitative modeling analyst specialization,University of Pennsylvania,Finance,finance quantitative modeling analyst specialization,4.6,Beginner level,40.0,statistical modeling capital budgeting corporate finance mathematical modeling cash flow financial analysis microsoft excel google sheet financial reporting regression analysis,https://www.coursera.org/specializations/finance-quantitative-modeling-analysts
data engineering big data machine learning gcp specialization,Google Cloud,Machine Learning,data engineering google cloud launch career data engineering deliver business value big data machine learning,4.6,Intermediate level,40.0,data infrastructure data integration dashboard big data mlops machine learning operation cloud storage cloud infrastructure data migration data processing google cloud platform,https://www.coursera.org/specializations/gcp-data-machine-learning
ai awakening implication economy society,Stanford University,Economics,ai awakening implication economy society,4.7,Beginner level,3.0,workforce development economics employee training artificial intelligence large language modeling business solution digital transformation innovation openai socioeconomics generative ai,https://www.coursera.org/learn/ai-awakening
information technology cloud fundamental specialization,IBM,Cloud Computing,kickstart new cloud career master hardware operating system programming database networking storage cybersecurity cloud computing essential,4.8,Beginner level,80.0,cloud computing cybersecurity peripheral device technical support computer hardware cloud application database network troubleshooting security awareness cloud infrastructure,https://www.coursera.org/specializations/it-cloud-fundamentals
ai infrastructure operation fundamental,NVIDIA,Machine Learning,ai infrastructure operation fundamental,4.6,Beginner level,40.0,data storage tensorflow computer architecture large language modeling cloud computing network infrastructure pytorch machine learning library generative ai machine learning deep learning,https://www.coursera.org/learn/ai-infrastructure-operations-fundamentals
generative ai everyone,DeepLearning.AI,Machine Learning,generative ai everyone,4.8,Beginner level,40.0,ethical standard conduct generative ai artificial intelligence cloud application prompt engineering business process automation openai large language modeling chatgpt,https://www.coursera.org/learn/generative-ai-for-everyone
introductory human physiology,Duke University,Basic Science,introductory human physiology,4.8,Beginner level,40.0,pulmonology nephrology neurology biology vital sign kinesiology urology respiration nutrition diet anatomy gynecology cardiology,https://www.coursera.org/learn/physiology
strategic leadership management specialization,University of Illinois Urbana-Champaign,Leadership and Management,leadership business skill immediate impact apply practical strategy becoming effective organizational leader,4.8,Beginner level,80.0,governance negotiation business strategy trustworthiness business management team motivation leadership development team management organizational structure team building,https://www.coursera.org/specializations/strategic-leadership
nasm personal fitness trainer professional certificate,National Academy of Sports Medicine,Basic Science,launch career personal fitness training master knowledge skill required support client making lasting lifestyle change,4.7,Beginner level,80.0,health assessment chronic disease automated external defibrillator nutrition education patient evaluation preventative care train trainer neurology rehabilitation injury prevention,https://www.coursera.org/professional-certificates/nasm-personal-fitness-trainer
prompt engineering educator specialization,Vanderbilt University,Education,educator prompt engineering elevate teaching tailored generative ai prompting skill,4.8,Beginner level,40.0,brainstorming large language modeling data synthesis game design productivity chatgpt openai prompt engineering organizational skill image analysis education software technology,https://www.coursera.org/specializations/prompt-engineering-for-educators
career success specialization,"University of California, Irvine",Business Essentials,build essential skill workplace improve employability advance today dynamic workforce,4.6,Beginner level,80.0,feasibility study communication strategy negotiation business planning project management cash management project control delegation skill goal setting leadership management,https://www.coursera.org/specializations/career-success
chatgpt excel personal automation gpts ai zapier specialization,Vanderbilt University,Machine Learning,master personal automation chatgpt zapier learn harness chatgpt ai tool gpts zapier automate task enhance productivity effectively solve realworld challenge across various domain,4.9,Beginner level,40.0,creative thinking brainstorming google workspace large language modeling workflow management agentic system expense report automation productivity chatgpt prompt engineering google sheet,https://www.coursera.org/specializations/chatgpt-gpt-zapier-excel-at-automation
pharmacy technician fundamental specialization,MedCerts,Patient Care,foundational pharmacy technician career training start pharmacy career learning essential dosage prescription anatomy soft skill essential healthcare career,4.7,Beginner level,40.0,pharmacology cultural diversity health information management medical record anatomy medication dispensation professionalism pharmacy operation medical terminology,https://www.coursera.org/specializations/pharmacy-technician-fundamentals
learn sql basic data science specialization,"University of California, Davis",Data Analysis,learn sql basic data science specialization,4.6,Beginner level,80.0,database design distributed computing databricks exploratory data analysis sql descriptive statistic data governance peer review presentation data storytelling data modeling,https://www.coursera.org/specializations/learn-sql-basics-data-science
genomic data science specialization,Johns Hopkins University,Data Analysis,next generation sequencing data scientist master tool technique forefront sequencing data revolution,4.4,Intermediate level,40.0,data analysis software r programming statistical modeling linux command computational thinking exploratory data analysis unix command molecular biology biostatistics statistical analysis,https://www.coursera.org/specializations/genomic-data-science
agile development specialization,University of Virginia,Design and Product,drive value agile method master adaptive approach product development,4.7,Beginner level,40.0,usability testing customer analysis continuous delivery agile project management persona user experience agile software development team management product testing team leadership,https://www.coursera.org/specializations/agile-development
stay ahead ai curve,Google,Machine Learning,course part google ai essential specialization,4.8,Beginner level,40.0,strategic thinking emerging technology workforce development generative ai data analysis business solution digital transformation analysis innovation,https://www.coursera.org/learn/google-stay-ahead-of-the-ai-curve
game theory,Stanford University,Economics,game theory,4.6,Beginner level,40.0,economics behavioral economics problem solving strategic decisionmaking mathematical modeling game theory probability algorithm graph theory bayesian statistic,https://www.coursera.org/learn/game-theory-1
certified cybersecurity specialization,ISC2,Security,advance career cybersecurity skill gain flexibility selfpaced learning,4.7,Beginner level,40.0,governance data security security control computer security awareness training event monitoring cybersecurity computer security incident management security management,https://www.coursera.org/specializations/certified-in-cybersecurity
generative ai business intelligence bi analyst specialization,IBM,Business Essentials,unlock potential generative ai bi learn use capability tool generative ai boost career business intelligence,4.8,Intermediate level,40.0,dashboard large language modeling chatgpt openai ibm cloud prompt engineering image analysis sql infographics interactive data visualization data storytelling data visualization,https://www.coursera.org/specializations/generative-ai-for-business-intelligence-analysts
regulatory compliance specialization,University of Pennsylvania,Business Essentials,learn create culture compliance master strategy building effective compliance program manage risk,4.8,Intermediate level,40.0,governance risk management compliance general data protection regulation gdpr data security regulation legal compliance personally identifiable information compliance auditing,https://www.coursera.org/specializations/regulatory-compliance
chatgpt excel aienhanced data analysis insight specialization,Vanderbilt University,Business Essentials,chatgptpowered excel transform data insight master aidriven excel skill automate task uncover insight create impactful data visualization,4.8,Beginner level,40.0,data integration large language modeling data synthesis pivot table chart productivity chatgpt prompt engineering excel formula data cleansing microsoft excel,https://www.coursera.org/specializations/chatgpt-excel
ai fundamental nondata scientist,University of Pennsylvania,Leadership and Management,course part ai business specialization,4.8,Beginner level,9.0,process optimization data analysis natural language processing tensorflow artificial neural network generative ai big data artificial intelligence deep learning customer data management,https://www.coursera.org/learn/wharton-ai-fundamentals-non-data-scientists
ibm system analyst professional certificate,IBM,Support and Operations,prepare career system analyst build indemand skill handson experience employer want prior experience degree required,4.8,Beginner level,160.0,user acceptance testing uat stakeholder engagement business process modeling business analysis computer hardware database management process analysis process optimization,https://www.coursera.org/professional-certificates/ibm-systems-analyst
leading modern day business specialization,University of Virginia,Leadership and Management,leading modern day business specialization,4.7,Beginner level,40.0,storytelling product lifecycle management creativity business strategy ideation technology strategy human centered design new product development digital transformation,https://www.coursera.org/specializations/leading-modern-day-business
prompt engineering law specialization,Vanderbilt University,Law,law generative ai edge harness generative ai transform legal research practice,4.8,Beginner level,40.0,legal research creative thinking brainstorming legal support large language modeling productivity chatgpt legal writing prompt engineering innovation travel arrangement,https://www.coursera.org/specializations/prompt-engineering-for-law
microsoft cloud support associate professional certificate,Microsoft,Cloud Computing,launch career cloud support associate build jobready skill indemand career information technology little month prior experience required get started,4.7,Beginner level,160.0,azure active directory identity access management cloud computing cybersecurity technical support microsoft computer hardware microsoft azure network troubleshooting,https://www.coursera.org/professional-certificates/microsoft-cloud-support-associate
financial market,Yale University,Finance,financial market,4.8,Beginner level,40.0,investment investment banking corporate finance financial policy business risk management financial regulation security finance market dynamic finance derivative,https://www.coursera.org/learn/financial-markets-global
introduction healthcare,Stanford University,Health Informatics,course part ai healthcare specialization,4.8,Beginner level,40.0,health care administration continuous quality improvement cqi medicare hospital medicine pharmaceutical medical billing coding health care healthcare ethic health system,https://www.coursera.org/learn/intro-to-healthcare
brand management aligning business brand behaviour,University of London,Entrepreneurship,brand management aligning business brand behaviour,4.9,Beginner level,40.0,employee engagement brand awareness branding organizational change brand strategy brand management crossfunctional collaboration global marketing brand marketing consumer behaviour,https://www.coursera.org/learn/brand
product management certification specialization,SkillUp EdTech,Leadership and Management,break new career product manager prior experience necessary quickly get job ready certified product manager,4.8,Beginner level,120.0,product planning product lifecycle management stakeholder engagement product roadmaps new product development product requirement project management life cycle innovation product testing,https://www.coursera.org/specializations/product-management-certification
business analytics excel elementary advanced,Johns Hopkins University,Business Essentials,business analytics excel elementary advanced,4.8,Intermediate level,40.0,microsoft excel business analysis business mathematics business modeling statistical analysis process optimization data modeling business analytics spreadsheet software,https://www.coursera.org/learn/business-analytics-excel
bit byte computer networking,Google,Networking,course part google support professional certificate,4.7,Beginner level,40.0,network protocol network routing network troubleshooting wireless network tcpip computer networking network security virtual private network vpn data integrity network administration,https://www.coursera.org/learn/computer-networking
adobe graphic designer professional certificate,Adobe,Marketing,launch graphic design career learn design fundamental build jobready skill using adobe photoshop illustrator express,4.7,Beginner level,200.0,process design storytelling file management digital design design review adobe illustrator client service prompt engineering image analysis branding logo design,https://www.coursera.org/professional-certificates/adobe-graphic-designer
ibm product manager professional certificate,IBM,Leadership and Management,prepare career product manager gain indemand skill handson experience get job ready less month prior experience required,4.7,Beginner level,40.0,product planning product lifecycle management usability testing stakeholder engagement agile project management product roadmaps new product development agile software development,https://www.coursera.org/professional-certificates/ibm-product-manager
deeplearningai tensorflow developer professional certificate,DeepLearning.AI,Machine Learning,learn build ai apps tensorflow build train optimize deep neural network dive deep computer vision natural language processing time series analysis along best practice handson experience one indemand deep learning framework,4.7,Intermediate level,80.0,machine learning kera neural network library forecasting text mining applied machine learning artificial neural network natural language processing image analysis supervised learning,https://www.coursera.org/professional-certificates/tensorflow-in-practice
data science specialization,Johns Hopkins University,Data Analysis,launch career data science tencourse introduction data science developed taught leading professor,4.5,Beginner level,280.0,r programming machine learning algorithm leaflet software github machine learning data wrangling rmarkdown exploratory data analysis plotly data cleansing regression analysis,https://www.coursera.org/specializations/jhu-data-science
fundamental cybersecurity specialization,IBM,Security,launch career cybersecurity acquire knowledge need work cybersecurity,4.6,Beginner level,40.0,identity access management linux server cloud computing cybersecurity computer security incident management window server linux networking hardware service management,https://www.coursera.org/specializations/it-fundamentals-cybersecurity
ibm darden digital strategy specialization,University of Virginia Darden School Foundation,Machine Learning,get ahead key business technical skill understand current technology changing industry create strategy transform business,4.8,Beginner level,40.0,business strategy big data cloud computing chatgpt digital transformation cloud infrastructure cloud computing architecture cloud hosting strategic thinking business transformation,https://www.coursera.org/specializations/digital-strategy
fintech foundation application financial technology specialization,University of Pennsylvania,Business Essentials,fintech foundation application financial technology specialization,4.6,Beginner level,40.0,digital asset payment processing cryptography creditdebit card processing lending underwriting technology strategy investment management investment fintech emerging technology,https://www.coursera.org/specializations/wharton-fintech
six sigma green belt specialization,Kennesaw State University,Business Essentials,improve career advanced six sigma dive deeper proven principle tool improve quality assurance organization,4.7,Intermediate level,40.0,six sigma methodology lean manufacturing process mapping statistical process control root cause analysis exploratory data analysis team management process improvement process capability,https://www.coursera.org/specializations/six-sigma-green-belt
microsoft cybersecurity analyst professional certificate,Microsoft,Security,launch career cybersecurity analyst build jobready skill musthave ai skill indemand career earn credential microsoft prior experience required,4.7,Beginner level,40.0,authentication active directory security information event management siem azure active directory threat management security testing cloud computing cybersecurity,https://www.coursera.org/professional-certificates/microsoft-cybersecurity-analyst
medical office procedure administration fundamental specialization,MedCerts,Healthcare Management,understanding procedure administration medical office procedure administration fundamental provides student comprehensive overview key administrative function healthcare setting including patient scheduling medical billing office management essential regulatory compliance equipping foundational skill needed excel medical office administration,4.7,Beginner level,120.0,electronic medical record cultural diversity health information management medical record professional development professionalism medical office procedure care coordination,https://www.coursera.org/specializations/medical-office-procedures-and-administration-fundamentals
algorithm specialization,Stanford University,Algorithms,learn think like computer scientist master fundamental design analysis algorithm,4.8,Intermediate level,40.0,network model computational thinking graph theory probability network routing mathematical theory analysis network analysis design strategy operation research bioinformatics analysis,https://www.coursera.org/specializations/algorithms
chatgpt project management leveraging ai success specialization,Vanderbilt University,Business Essentials,master project management chatgpt learn leverage chatgpt ai streamline project planning execution optimization transforming manage deliver successful project,4.8,Beginner level,40.0,creative thinking project management milestone project management large language modeling workflow management productivity project schedule chatgpt project risk management,https://www.coursera.org/specializations/chatgpt-project-management
ibm data warehouse engineer professional certificate,IBM,Data Management,kickstart career bi engineering develop jobready skill entry level role data warehousing,4.7,Beginner level,160.0,ibm cognos analytics database design linux command dashboard database administration data store shell script sql database management data warehousing,https://www.coursera.org/professional-certificates/data-warehouse-engineering
