Title,Partner,Subject,Description,Rating,Level,Duration (in hour),Skills,URL
microsoft business analyst professional certificate,Microsoft,Business Strategy,launch career business analyst build jobready skill indemand career business analysis little month prior experience required get started,4.6,Beginner level,120.0,business process modeling pivot table chart business analysis excel formula requirement analysis scrum software development user story requirement elicitation microsoft excel,https://www.coursera.org/professional-certificates/microsoft-business-analyst
data engineering foundation specialization,IBM,Data Management,build foundation data engineering career develop handson experience python sql relational database master fundamental data engineering ecosystem,4.7,Beginner level,80.0,database design database management system big data data store database sql data governance data warehousing data transformation data pipeline stored procedure ibm db,https://www.coursera.org/specializations/data-engineering-foundations
psychological first aid,Johns Hopkins University,Psychology,psychological first aid,4.8,Beginner level,6.0,trauma care crisis intervention triage stress management interpersonal communication patient referral community development rapport building active listening psychological evaluation,https://www.coursera.org/learn/psychological-first-aid
tableau business intelligence analyst professional certificate,Tableau Learning Partner,Data Analysis,launch career data analytics build indemand skill gain credential go beginner jobready month less degree prior experience required,4.7,Beginner level,320.0,spatial data analysis data visualization software dashboard tableau software business analysis exploratory data analysis requirement elicitation data governance data warehousing,https://www.coursera.org/professional-certificates/tableau-business-intelligence-analyst
think like cfo specialization,IESE Business School,Finance,think like cfo specialization,4.8,Beginner level,40.0,balance sheet working capital capital budgeting corporate finance financial management financial statement analysis accounting management accounting capital market cash flow,https://www.coursera.org/specializations/thinklikeacfo
meta react specialization,Meta,Mobile and Web Development,master fundamental advanced react concept learn react basic concept advanced practice,4.8,Intermediate level,40.0,html cs eventdriven programming reactjs unit testing ui component javascript integration testing javascript framework web application frontend web development,https://www.coursera.org/specializations/meta-react-specialization
excel skill business specialization,Macquarie University,Business Essentials,learn excel skill business master excel add highly valuable asset employability portfolio,4.9,Beginner level,120.0,dashboard data integrity data validation loan excel formula data cleansing business reporting microsoft excel data modeling excel macro data analysis expression dax data visualization,https://www.coursera.org/specializations/excel
business strategy specialization,University of Virginia,Business Strategy,steer business success generate value demonstrate global impact four course,4.8,Beginner level,40.0,governance growth strategy plan execution new business development project management business strategy innovation business research market analysis peer review strategic thinking,https://www.coursera.org/specializations/business-strategy
microsoft copilot leader specialization,Vanderbilt University,Machine Learning,copilot mastery leader master microsoft copilot redefine leadership productivity,4.8,Beginner level,40.0,verification validation ideation microsoft team microsoft chatgpt data validation prompt engineering proposal writing succession planning meeting facilitation,https://www.coursera.org/specializations/microsoft-365-copilot-for-leaders
ibm scrum master professional certificate,IBM,Leadership and Management,advance career scrum master develop indemand skill handson experience get jobready month,4.8,Beginner level,120.0,development environment software architecture agile project management computer hardware agile software development engineering software scrum software development user story,https://www.coursera.org/professional-certificates/ibm-it-scrum-master
ibm data science professional certificate,IBM,Data Analysis,prepare career data scientist build jobready skill musthave ai skill indemand career earn credential ibm prior experience required,4.6,Beginner level,40.0,data visualization software data wrangling dashboard matplotlib unsupervised learning exploratory data analysis plotly professional networking supervised learning sql data mining,https://www.coursera.org/professional-certificates/ibm-data-science
machine learning specialization,Stanford University,Machine Learning,breakintoai machine learning specialization master fundamental ai concept develop practical machine learning skill beginnerfriendly course program ai visionary andrew ng,4.9,Beginner level,80.0,machine learning algorithm machine learning machine learning method applied machine learning unsupervised learning random forest algorithm classification regression tree cart,https://www.coursera.org/specializations/machine-learning-introduction
crash course python,Google,Support and Operations,course part google automation python professional certificate,4.8,Beginner level,40.0,data structure integrated development environment debugging algorithm computational thinking computer programming programming principle problem management python programming,https://www.coursera.org/learn/python-crash-course
graphic design specialization,California Institute of the Arts,Music and Art,make compelling design learn apply principle graphic design towards comprehensive branding project,4.7,Beginner level,80.0,adobe indesign digital design graphic visual design art history branding logo design design strategy photo editing creative design style guide peer review,https://www.coursera.org/specializations/graphic-design
ai agent developer specialization,Vanderbilt University,Machine Learning,master skill ai agent software developer learn design build refine intelligent software agent using python generative ai agentic architecture realworld application,4.8,Beginner level,80.0,document management verification validation large language modeling agentic system ideation productivity chatgpt openai data validation software development prompt engineering,https://www.coursera.org/specializations/ai-agents
ibm product owner professional certificate,IBM,Leadership and Management,get jobready product owner month build skill employer look resume prepare pspo certification exam prior experience required,4.7,Beginner level,80.0,market intelligence agile project management product roadmaps virtual team chatgpt computer hardware stakeholder communication agile software development user story kanban principle,https://www.coursera.org/professional-certificates/ibm-product-owner
geographic information system gi specialization,"University of California, Davis",Data Analysis,map world gi explore tool concept terminology spatial analysis modeling,4.8,Beginner level,80.0,spatial data analysis data mapping data visualization software geographic information system file management land management spatial analysis geospatial mapping public health,https://www.coursera.org/specializations/gis
human resource management hr people manager specialization,University of Minnesota,Business Strategy,become better manager people develop strategy skill hiring managing performance rewarding employee,4.8,Beginner level,80.0,constructive feedback employee performance management job analysis workforce planning performance review performance management compensation benefit human resource people management,https://www.coursera.org/specializations/human-resource-management
ibm generative ai engineering professional certificate,IBM,Machine Learning,develop jobready gen ai skill employer need build highly soughtafter gen ai engineering skill practical experience month prior experience required,4.7,Beginner level,240.0,unit testing kera neural network library data wrangling large language modeling applied machine learning pytorch machine learning library flask web framework unsupervised learning,https://www.coursera.org/professional-certificates/ibm-generative-ai-engineering
process data dirty clean,Google,Data Analysis,course part google data analytics professional certificate,4.8,Beginner level,40.0,data transformation data integrity sample size determination data validation spreadsheet software data processing sampling statistic data cleansing data quality sql data analysis,https://www.coursera.org/learn/process-data
foundation user experience ux design,Google,Design and Product,course part google ux design professional certificate,4.8,Beginner level,40.0,design thinking sprint planning web content accessibility guideline usability testing user research usability prototyping persona user experience user centered design wireframing,https://www.coursera.org/learn/foundations-user-experience-design
discover art prompting,Google,Machine Learning,course part google ai essential specialization,4.9,Beginner level,40.0,prompt engineering content creation technical writing large language modeling,https://www.coursera.org/learn/google-discover-the-art-of-prompting
ai python beginner,DeepLearning.AI,Software Development,ai python beginner,4.8,Beginner level,40.0,jupyter large language modeling scripting computer programming application development data analysis artificial intelligence application programming interface api automation,https://www.coursera.org/learn/ai-python-for-beginners
architecting google compute engine specialization,Google Cloud,Cloud Computing,launch career cloud architecture design develop manage cloud solution drive business objective,4.7,Intermediate level,40.0,containerization identity access management cloud computing service level agreement microservices application deployment service level prompt engineering cloud storage,https://www.coursera.org/specializations/gcp-architecture
human anatomy medical terminology fundamental specialization,MedCerts,Basic Science,human anatomy physiology allied health learn anatomical structure terminology relevant human body interactive engaging online content,4.8,Beginner level,40.0,general medical test procedure cardiology medical billing coding health information management medical record anatomy urology neurology pulmonology physical therapy,https://www.coursera.org/specializations/human-anatomy-medical-terminology-fundamentals
project planning putting together,Google,Leadership and Management,course part google project management professional certificate,4.8,Beginner level,40.0,project schedule estimation procurement timeline project planning project documentation strategic thinking communication planning project management budgeting risk management,https://www.coursera.org/learn/project-planning-google
python data science ai development,IBM,Data Analysis,course part multiple program learn,4.6,Beginner level,40.0,application programming interface api data structure object oriented programming oop file management numpy python programming data manipulation computer programming jupyter,https://www.coursera.org/learn/python-for-applied-data-science-ai
adp entrylevel payroll specialist professional certificate,"Automatic Data Processing, Inc. (ADP)",Finance,become successful entrylevel payroll specialist gain knowledge develop jobready skill exciting career diverse field payroll degree experience required,4.7,Beginner level,40.0,benefit administration payroll processing labor law tax management compensation benefit human resource tax compliance payroll system compensation management labor compliance,https://www.coursera.org/professional-certificates/adp-payroll-specialist
hrci human resource associate professional certificate,HRCI,Leadership and Management,launch career human resource program youll learn indemand skill career human resource associate degree prior experience needed courseras learner first award winner,4.8,Beginner level,40.0,employee performance management business continuity planning job analysis performance management compensation benefit employee relation compensation management recruitment,https://www.coursera.org/professional-certificates/hrci-human-resource-associate
intuit academy bookkeeping professional certificate,Intuit,Business Essentials,launch career bookkeeping gain professional skill need succeed bookkeeping field degree prior experience required,4.6,Beginner level,80.0,payroll processing balance sheet inventory accounting property accounting accounting software financial statement analysis quickbooks accounting software payroll administration,https://www.coursera.org/professional-certificates/intuit-bookkeeping
accelerate job search ai,Google,Personal Development,course part multiple program learn,4.8,Beginner level,40.0,personal attribute problem solving professional development generative ai interviewing skill writing editing communication,https://www.coursera.org/learn/accelerate-your-job-search-with-ai
meta social medium marketing professional certificate,Meta,Marketing,launch career social medium marketer build jobready skill musthave ai skill indemand career earn credential meta month less degree prior experience required,4.8,Beginner level,40.0,advertising social medium campaign management instagram performance analysis goal setting key performance indicator kpis marketing marketing effectiveness marketing analytics,https://www.coursera.org/professional-certificates/facebook-social-media-marketing
data analysis visualization foundation specialization,IBM,Data Analysis,get ahead w data analysis visualization skill enhance career learning analyze data using excel spreadsheet create stunning visualization interactive dashboard cognos,4.8,Beginner level,40.0,ibm cognos analytics data visualization software data wrangling dashboard big data data mart excel formula data cleansing apache hadoop microsoft excel data mining data collection,https://www.coursera.org/specializations/data-analysis-visualization-foundations
ask question make datadriven decision,Google,Data Analysis,course part google data analytics professional certificate,4.7,Beginner level,40.0,spreadsheet software business analysis problem solving dashboard data presentation data analysis quantitative research datadriven decisionmaking stakeholder communication,https://www.coursera.org/learn/ask-questions-make-decisions
financial engineering risk management specialization,Columbia University,Finance,advance knowledge financial engineering build fundamental technical skill financial engineering,4.6,Intermediate level,80.0,risk modeling derivative market liquidity investment management mathematical modeling capital market applied mathematics financial trading mortgage loan security finance,https://www.coursera.org/specializations/financialengineering
preparing google cloud certification machine learning engineer professional certificate,Google Cloud,Cloud Computing,advance career cloud ml engineer,4.5,Intermediate level,80.0,machine learning kera neural network library mlops machine learning operation cloud computing prompt engineering artificial intelligence machine learning aiml,https://www.coursera.org/professional-certificates/preparing-for-google-cloud-machine-learning-engineer-professional-certificate
ibm data engineering professional certificate,IBM,Data Management,prepare career data engineer build jobready skill musthave ai skill indemand career earn credential ibm prior experience required,4.7,Beginner level,40.0,ibm cognos analytics database design linux command database administration data store professional networking sql apache hadoop nosql data warehousing apache spark web scraping,https://www.coursera.org/professional-certificates/ibm-data-engineer
management fashion luxury company,Università Bocconi,Leadership and Management,management fashion luxury company,4.7,Beginner level,12.0,brand management consumer behaviour digital medium strategy product development retail store operation communication strategy customer experience strategy cx global marketing,https://www.coursera.org/learn/mafash
leadership skill,IIMA - IIM Ahmedabad,Leadership and Management,leadership skill,4.9,Beginner level,40.0,personal development business leadership mindfulness selfawareness business ethic leadership communication leadership management influencing relationship building empowerment,https://www.coursera.org/learn/leadershipskills
ibm program manager professional certificate,IBM,Leadership and Management,get jobready program manager month build indemand skill prepare pmipgmp certification exam experience required,4.8,Beginner level,80.0,project management stakeholder engagement agile project management resource management agile software development project management life cycle resource allocation user story,https://www.coursera.org/professional-certificates/ibm-program-manager
like lead interact customer online,Google,Marketing,course part google digital marketing ecommerce professional certificate,4.8,Beginner level,40.0,digital advertising content strategy customer engagement social medium management content creation social medium marketing digital marketing target audience advertising campaign,https://www.coursera.org/learn/from-likes-to-leads
aws cloud technology consultant professional certificate,Amazon Web Services,Cloud Computing,start career cloud technology consultant program youll learn indemand skill advise client use cloud technology meet business objective degree experience required,4.8,Beginner level,40.0,teamwork software architecture cloud computing amazon aws identity access management iam professional networking cloud computing architecture cicd cloud management,https://www.coursera.org/professional-certificates/aws-cloud-technology-consultant
generative ai software development skill certificate,DeepLearning.AI,Software Development,leverage ai software development workflow learn practical prompt engineering pair programming technique llm write test improve code,4.7,Beginner level,40.0,database design system design implementation machine learning collaborative software software architecture large language modeling software engineering technical documentation chatgpt,https://www.coursera.org/professional-certificates/generative-ai-for-software-development
agile project management,Google,Leadership and Management,course part google project management professional certificate,4.8,Beginner level,40.0,sprint retrospective coaching organizational change backlog prioritization team management influencing kanban principle user story problem solving sprint planning agile product development,https://www.coursera.org/learn/agile-project-management
google advanced data analytics professional certificate,Google,Data Analysis,learn indemand skill like statistical analysis python regression model machine learning less month,4.8,Advanced level,40.0,machine learning data visualization software interviewing skill tableau software exploratory data analysis descriptive statistic regression analysis sampling statistic,https://www.coursera.org/professional-certificates/google-advanced-data-analytics
operating system becoming power user,Google,Support and Operations,course part google support professional certificate,4.7,Beginner level,40.0,authorization computing commandline interface linux user account linux administration system administration system monitoring file system remote access system,https://www.coursera.org/learn/os-power-user
introduction psychology,Yale University,Psychology,introduction psychology,4.9,Beginner level,40.0,mental health child development biology critical thinking behavioral health problem solving neurology scientific method human learning mental behavioral health specialty,https://www.coursera.org/learn/introduction-psychology
introduction ai,Google,Machine Learning,course part google ai essential specialization,4.9,Beginner level,40.0,machine learning critical thinking innovation machine learning software data quality generative ai artificial intelligence machine learning aiml,https://www.coursera.org/learn/google-introduction-to-ai
tesol certificate part teach english specialization,Arizona State University,Learning English,tesol certificate part ii teach english apply principle language teaching reading writing listening speaking,4.9,Beginner level,80.0,end user training support grammar technology strategy organizational skill digital transformation education software technology innovation emerging technology teaching,https://www.coursera.org/specializations/tesol-certificate-2
meta io developer professional certificate,Meta,Mobile and Web Development,launch career io developer build jobready skill indemand career earn credential meta degree prior experience required get started,4.6,Beginner level,40.0,usability testing github javascript apple io react native persona user experience interaction design io development unix command user interface ui core data software,https://www.coursera.org/professional-certificates/meta-ios-developer
management consulting specialization,Emory University,Leadership and Management,management consultant career skill tool work like management consultant smarter faster,4.9,Beginner level,40.0,six sigma methodology storytelling management consulting interviewing skill proposal development microsoft powerpoint data cleansing business research executive presence microsoft excel,https://www.coursera.org/specializations/managementconsulting
preparing google cloud certification cloud devops engineer professional certificate,Google Cloud,Cloud Computing,advance career sre devops engineer,4.8,Beginner level,40.0,containerization identity access management event monitoring service level agreement application deployment prompt engineering cloud storage cloud infrastructure,https://www.coursera.org/professional-certificates/sre-devops-engineer-google-cloud
sap business analyst professional certificate,SAP,Business Strategy,launch career business analyst build indemand skill earn credential go beginner jobready less month,4.4,Beginner level,120.0,stakeholder engagement business process modeling process mapping performance measurement business analysis user requirement document stakeholder communication process improvement,https://www.coursera.org/professional-certificates/sap-business-analyst
ibm support professional certificate,IBM,Support and Operations,prepare career support specialist build jobready skill prep comptia itf certification exam prior experience needed,4.8,Beginner level,40.0,cloud computing cybersecurity peripheral device technical support cloud application professional networking network troubleshooting cloud infrastructure cloud computing architecture,https://www.coursera.org/professional-certificates/ibm-technical-support
six sigma yellow belt specialization,Kennesaw State University,Leadership and Management,improve career six sigma knowledge learn proven principle tool improve quality assurance organization,4.7,Beginner level,40.0,six sigma methodology project management statistical process control root cause analysis business process kaizen methodology team management process improvement process capability,https://www.coursera.org/specializations/six-sigma-fundamentals
ibm ai developer professional certificate,IBM,Software Development,kickstart career artificial intelligence build jobready skill ai technology generative ai model programming learn build aipowered chatbots apps month,4.6,Beginner level,40.0,development environment unit testing machine learning software architecture large language modeling flask web framework software engineering chatgpt software development,https://www.coursera.org/professional-certificates/applied-artifical-intelligence-ibm-watson-ai
generative ai chatgpt k educator specialization,Vanderbilt University,Education,harness generative ai engaging k teaching learn integrate generative ai teaching create engaging lesson foster student creativity enhance problemsolving classroom,4.8,Beginner level,40.0,creative thinking brainstorming creativity technical communication large language modeling game design productivity chatgpt prompt engineering education software technology innovation,https://www.coursera.org/specializations/generative-ai-k12-educators
ai everyone,DeepLearning.AI,Business Strategy,ai everyone,4.8,Beginner level,40.0,strategic thinking business ethic data ethic artificial neural network deep learning need assessment market opportunity artificial intelligence machine learning aiml,https://www.coursera.org/learn/ai-for-everyone
google cloud cybersecurity professional certificate,Google Cloud,Cloud Computing,launch career cloud cybersecurity build jobready skill musthave ai skill indemand career earn credential google cloud prior experience required,4.6,Beginner level,40.0,data security identity access management threat management cyber threat hunting event monitoring large language modeling cybersecurity intrusion detection prevention,https://www.coursera.org/professional-certificates/google-cloud-cybersecurity-certificate
ibm data analyst professional certificate,IBM,Data Analysis,prepare career data analyst build jobready skill musthave ai skill indemand career earn credential ibm prior experience required,4.7,Beginner level,40.0,ibm cognos analytics data visualization software data wrangling dashboard matplotlib big data exploratory data analysis plotly professional networking excel formula sql microsoft excel,https://www.coursera.org/professional-certificates/ibm-data-analyst
