Title,Partner,Subject,Description,Rating,Level,Duration,Skills,URL
Introduction to Negotiation: A Strategic Playbook for Becoming a Principled and Persuasive Negotiator,Yale University,Business Essentials,Instructor: Barry Nalebuff,4.8,,33 hours to complete,"['Relationship Building', 'Communication', 'Persuasive Communication', 'Mediation', 'Strategic Decision-Making', 'Conflict Management', 'Collaboration', 'Game Theory', 'Contract Negotiation', 'Influencing', 'Negotiation']",https://www.coursera.org/learn/negotiation
Project Execution: Running the Project,Google,Leadership and Management,This course is part of Google Project Management: Professional Certificate,4.8,Beginner level,Flexible schedule,"['Strategic Thinking', 'Team Management', 'Project Controls', 'Continuous Improvement Process', 'Quality Management', 'Project Documentation', 'Stakeholder Communications', 'Project Management Life Cycle']",https://www.coursera.org/learn/project-execution-google
Attract and Engage Customers with Digital Marketing,Google,Marketing,This course is part of Google Digital Marketing & E-commerce Professional Certificate,4.8,Beginner level,Flexible schedule,"['Digital Advertising', 'Advertising Campaigns', 'Google Analytics', 'Online Advertising', 'Keyword Research', 'Google Ads', 'Search Engine Optimization', 'Digital Marketing', 'Marketing Strategies', 'Marketing']",https://www.coursera.org/learn/attract-and-engage-customers
IBM Data Analytics with Excel and R Professional Certificate,IBM,Data Analysis,Prepare for a career in data analytics. Gain the in-demand skills and hands-on experience to get job-ready in less than 3 months. No prior experience required.,4.7,Beginner level,Flexible schedule,"['IBM Cognos Analytics', 'Database Design', 'Data Visualization Software', 'Data Wrangling', 'Dashboard', 'Big Data', 'Exploratory Data Analysis', 'Excel Formulas', 'Microsoft Excel', 'Data Mining', 'Data Manipulation']",https://www.coursera.org/professional-certificates/ibm-data-analyst-r-excel
Speed Up Data Analysis and Presentation Building,Google,Machine Learning,This course is part of Google Prompting Essentials Specialization,4.8,Beginner level,Flexible schedule,"['Prompt Engineering', 'Data Analysis', 'Data Presentation', 'Graphing', 'Oral Expression', 'Data Visualization', 'Data Storytelling']",https://www.coursera.org/learn/google-speed-up-data-analysis-and-presentation-building
Google Cybersecurity Professional Certificate,Google,Computer Security and Networks,"Get on the fast track to a career in cybersecurity. In this certificate program, you'll learn in-demand skills, and get AI training from Google experts. Learn at your own pace, no degree or experience required.",4.8,Beginner level,Flexible schedule,"['Interviewing Skills', 'Threat Management', 'Cybersecurity', 'Intrusion Detection and Prevention', 'Computer Security Incident Management', 'Linux', 'Debugging', 'SQL', 'Incident Response', 'Hardening']",https://www.coursera.org/professional-certificates/google-cybersecurity
Microsoft Full-Stack Developer Professional Certificate,Microsoft,Mobile and Web Development,Launch your Career in Full-Stack Development. Start your journey as a full-stack developer. Develop job-ready AI-powered skills and earn a certificate from Microsoft. No experience required.,4.6,Beginner level,9 months,"['HTML and CSS', 'Authentications', 'Full-Stack Web Development', 'Continuous Integration', 'GitHub', 'Graph Theory', 'Application Deployment', 'Role-Based Access Control (RBAC)', 'Debugging', 'SQL', 'CI/CD']",https://www.coursera.org/professional-certificates/microsoft-full-stack-developer
Introduction to Finance and Accounting Specialization,University of Pennsylvania,Finance,Learn the basics of finance and accounting. Build a foundation of core business skills in finance and accounting,4.4,Beginner level,1 month,"['Balance Sheet', 'Business Valuation', 'Working Capital', 'Capital Budgeting', 'Corporate Finance', 'Financial Statement Analysis', 'Accounting', 'Cash Flows', 'Financial Analysis', 'Financial Accounting']",https://www.coursera.org/specializations/finance-accounting
"Unsupervised Learning, Recommenders, Reinforcement Learning",DeepLearning.AI,Machine Learning,This course is part of Machine Learning Specialization,4.9,Beginner level,Flexible schedule,"['Statistical Machine Learning', 'Applied Machine Learning', 'Machine Learning Algorithms', 'Deep Learning', 'Anomaly Detection', 'Machine Learning Methods', 'Unsupervised Learning']",https://www.coursera.org/learn/unsupervised-learning-recommenders-reinforcement-learning
Programming for Everybody (Getting Started with Python),University of Michigan,Software Development,This course is part of Python for Everybody Specialization,4.8,Beginner level,Flexible schedule,"['Python Programming', 'Scripting', 'Scripting Languages', 'Computational Thinking', 'Programming Principles', 'Development Environment', 'Computer Programming']",https://www.coursera.org/learn/python
"Assets, Threats, and Vulnerabilities",Google,Computer Security and Networks,This course is part of Google Cybersecurity Professional Certificate,4.8,Beginner level,Flexible schedule,"['Risk Management Framework', 'Authentications', 'Threat Detection', 'Threat Modeling', 'Threat Management', 'NIST 800-53', 'Vulnerability Assessments', 'MITRE ATT&CK Framework', 'Cyber Threat Intelligence']",https://www.coursera.org/learn/assets-threats-and-vulnerabilities
Medical Billing and Coding Fundamentals Specialization,MedCerts,Health Informatics,"Gain the Medical Billing and Coding Fundamentals. Prepare for a career in the Medical Billing industry by gaining an understanding of the language of insurance, revenue cycles, and more.",4.8,Beginner level,1 month,"['Health Care Procedure and Regulation', 'Electronic Medical Record', 'Cultural Diversity', 'Payment Processing', 'Medical Billing and Coding', 'Health Information Management and Medical Records', 'Anatomy']",https://www.coursera.org/specializations/medical-billing-coding-fundamentals
Google Cloud Data Analytics Professional Certificate,Google Cloud,Cloud Computing,Launch your career in Cloud Data Analytics. Build in-demand skills and gain credentials to go from beginner to job-ready in 10 weeks or less. No degree or prior experience required.,4.5,Beginner level,Flexible schedule,"['Data Visualization Software', 'Dashboard', 'Cloud Computing', 'Data Cleansing', 'Cloud Storage', 'Cloud Infrastructure', 'Database Management', 'Data Governance', 'Google Cloud Platform', 'Data Transformation']",https://www.coursera.org/professional-certificates/google-cloud-data-analytics-certificate
Supervised Machine Learning: Regression and Classification,DeepLearning.AI,Machine Learning,This course is part of Machine Learning Specialization,4.9,Beginner level,Flexible schedule,"['Unsupervised Learning', 'Predictive Modeling', 'Scikit Learn (Machine Learning Library)', 'Python Programming', 'Feature Engineering', 'Machine Learning', 'Classification And Regression Tree (CART)']",https://www.coursera.org/learn/machine-learning
Stanford Introduction to Food and Health,Stanford University,Nutrition,"Instructor: Maya Adam, MD",4.7,Beginner level,Flexible schedule,"['Public Health and Disease Prevention', 'Nutrition and Diet', 'Chronic Diseases', 'Cooking', 'Health Informatics', 'Food and Beverage', 'Clinical Nutrition', 'Behavioral Health', 'Preventative Care']",https://www.coursera.org/learn/food-and-health
Tools of the Trade: Linux and SQL,Google,Computer Security and Networks,This course is part of Google Cybersecurity Professional Certificate,4.8,Beginner level,Flexible schedule,"['File Systems', 'Relational Databases', 'Unix', 'Authentications', 'User Accounts', 'Command-Line Interface', 'SQL', 'Operating Systems', 'Database Management', 'Linux', 'Authorization (Computing)', 'Linux Commands']",https://www.coursera.org/learn/linux-and-sql
Leading People and Teams Specialization,University of Michigan,Leadership and Management,Leading Effectively. Learn proven management techniques in just four courses.,4.8,Beginner level,1 month,"['Persuasive Communication', 'Teamwork', 'Performance Review', 'Interviewing Skills', 'Team Motivation', 'Talent Management', 'Talent Recruitment', 'Employee Engagement', 'Team Management', 'Employee Coaching']",https://www.coursera.org/specializations/leading-teams
Meta Front-End Developer Professional Certificate,Meta,Mobile and Web Development,Launch your career as a front-end developer. Build job-ready skills for an in-demand career and earn a credential from Meta. No degree or prior experience required to get started.,4.7,Beginner level,Flexible schedule,"['HTML and CSS', 'Usability Testing', 'React.js', 'GitHub', 'User Experience Design', 'Javascript', 'Persona (User Experience)', 'Interaction Design', 'Cascading Style Sheets (CSS)', 'Front-End Web Development']",https://www.coursera.org/professional-certificates/meta-front-end-developer
IBM Back-End Development Professional Certificate,IBM,Software Development,Prepare for a career as a back-end developer. Gain the in-demand skills and hands-on experience to get job-ready in less than 6 months.,4.7,Beginner level,6 months,"['Linux Commands', 'Object-Relational Mapping', 'Software Architecture', 'Flask (Web Framework)', 'Cloud-Native Computing', 'Microservices', 'Application Deployment', 'Shell Script', 'Istio']",https://www.coursera.org/professional-certificates/ibm-backend-development
IBM IT Project Manager Professional Certificate,IBM,Leadership and Management,Launch your career as an IT project manager. Get job-ready and prep for the Certified Associate in Project Management (CAPM) certification exam.,4.8,Beginner level,4 months,"['Development Environment', 'Interviewing Skills', 'Software Architecture', 'Project Management', 'Stakeholder Engagement', 'Resource Management', 'Project Risk Management', 'Agile Software Development']",https://www.coursera.org/professional-certificates/ibm-it-project-manager
Digital Marketing Specialization,University of Illinois Urbana-Champaign,Marketing,"Drive Customer Behavior Online. A six-course overview of the latest digital marketing skills, taught by industry experts.",4.6,Beginner level,4 months,"['Digital Advertising', 'Content Marketing', 'Digital Media Strategy', 'Marketing Communications', 'Google Analytics', 'Marketing', 'Analytics', 'Marketing Analytics', 'Email Marketing', 'Digital Marketing']",https://www.coursera.org/specializations/digital-marketing
Introduction to Statistics,Stanford University,Data Analysis,Instructor: Guenther Walther,4.6,Beginner level,Flexible schedule,"['Statistical Modeling', 'Data Analysis', 'Exploratory Data Analysis', 'Quantitative Research', 'Data Collection', 'Probability Distribution', 'Statistical Methods', 'Sampling (Statistics)', 'Regression Analysis']",https://www.coursera.org/learn/stanford-statistics
Google Prompting Essentials Specialization,Google,Machine Learning,Unlock AI’s Potential with Effective Prompts. Learn from Google experts how to use AI effectively by writing clear and specific prompts.,4.8,Beginner level,1 month,"['Document Management', 'Machine Learning', 'Graphing', 'Ideation', 'Solution Design', 'ChatGPT', 'Report Writing', 'Prompt Engineering', 'Business Correspondence', 'Taking Meeting Minutes', 'Critical Thinking']",https://www.coursera.org/specializations/prompting-essentials-google
Generative AI for Educators Specialization,IBM,Education,Reinvent teaching with gen AI-powered innovation. Learn how to leverage gen AI tools to transform education and training and drive excellent learning experiences in just a few weeks!,4.9,Beginner level,1 month,"['Data Security', 'Virtual Environment', 'Large Language Modeling', 'ChatGPT', 'OpenAI', 'IBM Cloud', 'Prompt Engineering', 'Image Analysis', 'Education Software and Technology', 'Emerging Technologies']",https://www.coursera.org/specializations/generative-ai-educators
Analyze Data to Answer Questions,Google,Data Analysis,This course is part of Google Data Analytics Professional Certificate,4.6,Beginner level,Flexible schedule,"['Pivot Tables And Charts', 'Data Integration', 'Data Transformation', 'Analytics', 'Excel Formulas', 'Data Validation', 'Data Compilation', 'SQL', 'Data Analysis', 'User Feedback', 'Spreadsheet Software', 'Data Manipulation']",https://www.coursera.org/learn/analyze-data
Build Wireframes and Low-Fidelity Prototypes,Google,Design and Product,This course is part of Google UX Design Professional Certificate,4.9,Beginner level,Flexible schedule,"['User Story', 'Information Architecture', 'User Experience Design', 'Figma (Design Software)', 'Prototyping', 'User Centered Design', 'Storyboarding', 'User Interface (UI)', 'Mockups', 'Wireframing', 'Usability']",https://www.coursera.org/learn/wireframes-low-fidelity-prototypes
Preparing for Google Cloud Certification: Cloud Developer Professional Certificate,Google Cloud,Cloud Computing,Developer Best Practices on Google Cloud,4.7,Intermediate level,2 months,"['Containerization', 'Identity and Access Management', 'Cloud Computing', 'Microservices', 'Cloud Applications', 'Application Deployment', 'Prompt Engineering', 'Debugging', 'Cloud Storage', 'Cloud Infrastructure', 'CI/CD']",https://www.coursera.org/professional-certificates/google-cloud-developer
Google Business Intelligence Professional Certificate,Google,Data Analysis,"Learn in-demand skills like data modeling, data visualization, and dashboarding and reporting in less than 2 months.",4.8,Advanced level,Flexible schedule,"['Database Design', 'Interviewing Skills', 'Dashboard', 'Stakeholder Engagement', 'Professional Development', 'Data Integrity', 'Tableau Software', 'Business Analysis', 'Business Process', 'Stakeholder Communications']",https://www.coursera.org/professional-certificates/google-business-intelligence
Microsoft IT Support Specialist Professional Certificate,Microsoft,Support and Operations,Launch your career as an IT support specialist. Build job-ready skills – and must-have AI skills – for an in-demand career. Earn a credential from Microsoft. No prior experience required.,4.8,Beginner level,3 months,"['Collaborative Software', 'System Support', 'Application Security', 'Cloud Computing', 'Cybersecurity', 'Technical Support', 'Microsoft Teams', 'Microsoft 365', 'Computer Hardware', 'Network Troubleshooting']",https://www.coursera.org/professional-certificates/microsoft-it-support-specialist
Data Science Foundations Specialization,University of London,Data Analysis,"Unlock Academic & Career Success with Data Science. Build the foundational knowledge and hands-on skills you need to forge new career opportunities, with no technical experience required.",4.7,Beginner level,3 months,"['Machine Learning Algorithms', 'Machine Learning', 'Data Visualization Software', 'Project Management', 'Dashboard', 'Unsupervised Learning', 'Pandas (Python Package)', 'NumPy', 'Pseudocode', 'Data Mining']",https://www.coursera.org/specializations/data-science-foundations
IBM Data Architecture Professional Certificate,IBM,Data Management,"Launch your career as a data architect. Learn in-demand skills like data engineering, database management, and data architecture in less than 5 months.",4.7,Beginner level,4 months,"['Database Design', 'Data Security', 'Linux Commands', 'Database Administration', 'Data Store', 'SQL', 'Database Management', 'Apache Hadoop', 'Data Migration', 'NoSQL', 'Data Governance', 'Data Warehousing']",https://www.coursera.org/professional-certificates/ibm-data-architect
Machine Learning on Google Cloud Specialization,Google Cloud,Machine Learning,Learn machine learning with Google Cloud. Real-world experimentation with end-to-end ML,4.6,Intermediate level,1 month,"['Machine Learning', 'Keras (Neural Network Library)', 'MLOps (Machine Learning Operations)', 'Workflow Management', 'Applied Machine Learning', 'Cloud Computing', 'Application Deployment', 'Prompt Engineering']",https://www.coursera.org/specializations/machine-learning-tensorflow-gcp
IBM Introduction to Machine Learning Specialization,IBM,Data Analysis,Learn machine learning through real use cases. Build the skills for a career in one of the most relevant fields of modern AI through hands-on projects and curriculum from IBM’s experts.,4.7,Intermediate level,2 months,"['Machine Learning Algorithms', 'Statistical Modeling', 'Machine Learning', 'Applied Machine Learning', 'Unsupervised Learning', 'Exploratory Data Analysis', 'Classification And Regression Tree (CART)']",https://www.coursera.org/specializations/ibm-intro-machine-learning
Applied Software Engineering Fundamentals Specialization,IBM,Software Development,"Build the foundation of your career in Software. Develop hands-on experience with Git, GitHub, Linux, and Python, and learn the fundamentals of Software Engineering.",4.7,Beginner level,Flexible schedule,"['Development Environment', 'Unit Testing', 'Linux Commands', 'GitHub', 'Software Architecture', 'File Management', 'Flask (Web Framework)', 'Application Deployment', 'Shell Script', 'Linux', 'Engineering Software']",https://www.coursera.org/specializations/software-engineering-fundamentals
Google Cloud Digital Leader Training Professional Certificate,Google Cloud,Cloud Computing,Gain foundational literacy in cloud & digital transformation. Increase your cloud confidence so you can speak with colleagues in technical cloud roles and contribute to informed cloud-related business decisions.,4.8,Beginner level,1 month,"['Data Security', 'Big Data', 'Cloud Computing', 'Digital Transformation', 'Cloud Infrastructure', 'Cloud Management', 'Data Governance', 'Google Cloud Platform', 'Data Warehousing', 'Serverless Computing']",https://www.coursera.org/professional-certificates/google-cloud-digital-leader-training
Generative AI Data Analyst Specialization,Vanderbilt University,Data Analysis,"Become a Generative AI Data Analyst. Learn how to use ChatGPT and generative AI tools to analyze data, automate workflows, and communicate insights with clarity and impact.",4.8,Beginner level,1 month,"['Document Management', 'Data Integration', 'Large Language Modeling', 'Data Synthesis', 'Pivot Tables And Charts', 'Productivity', 'ChatGPT', 'Prompt Engineering', 'Excel Formulas', 'Data Cleansing', 'Databases', 'SQL']",https://www.coursera.org/specializations/generative-ai-data-analyst
Introduction to Programming with Python and Java Specialization,University of Pennsylvania,Software Development,"Boost Your Computer Programming Skills. With minimal previous exposure, learn two popular programming languages at an accelerated pace.",4.5,Beginner level,2 months,"['Java', 'Unit Testing', 'Programming Principles', 'Data Visualization Software', 'Eclipse (Software)', 'Matplotlib', 'Pivot Tables And Charts', 'Pandas (Python Package)', 'Java Programming', 'Debugging', 'Data Cleansing']",https://www.coursera.org/specializations/programming-python-java
Gemini for Google Workspace Specialization,Google Cloud,Cloud Computing,Use generative AI features in Google Workspace. Learn how to use generative AI with Gemini for Google Workspace to improve your productivity and efficiency,4.6,Beginner level,1 month,"['Storytelling', 'Video Production', 'Multimedia', 'Project Management', 'Google Workspace', 'Media Production', 'Workflow Management', 'Writing', 'Prompt Engineering', 'Video Editing', 'Google Sheets', 'Collaboration']",https://www.coursera.org/specializations/gemini-for-google-workspace
Prompt Engineering for ChatGPT,Vanderbilt University,Machine Learning,"This course is part of multiple programs.
Learn more",4.8,Beginner level,Flexible schedule,"['Large Language Modeling', 'Productivity', 'Problem Solving', 'ChatGPT', 'Collaboration', 'Creative Thinking', 'Prompt Engineering', 'Ingenuity', 'Brainstorming', 'Generative AI', 'Application Development']",https://www.coursera.org/learn/prompt-engineering
Introduction to Data Science Specialization,IBM,Data Analysis,Launch your career in data science. Gain foundational data science skills to prepare for a career or further advanced learning in data science.,4.7,Beginner level,1 month,"['Data Analysis Software', 'GitHub', 'Big Data', 'Cloud Computing', 'Business Analysis', 'Data Cleansing', 'Databases', 'SQL', 'Data Mining', 'Query Languages', 'Data Literacy', 'Peer Review']",https://www.coursera.org/specializations/introduction-data-science
Introduction to Marketing,University of Pennsylvania,Marketing,This course is part of Business Foundations Specialization,4.8,,10 hours to complete,"['Brand Strategy', 'Customer experience strategy (CX)', 'Brand Awareness', 'Marketing Communications', 'Customer Insights', 'Marketing', 'Price Negotiation', 'Communication Strategies', 'Brand Loyalty']",https://www.coursera.org/learn/wharton-marketing
Generative AI Fundamentals Specialization,IBM,Machine Learning,Unlock and leverage the potential of generative AI. Learn how you can use the capabilities of generative AI to enhance your work and daily life.,4.7,Beginner level,1 month,"['Large Language Modeling', 'ChatGPT', 'Artificial Neural Networks', 'OpenAI', 'IBM Cloud', 'Prompt Engineering', 'Leadership and Management', 'Business Development', 'Deep Learning', 'Business Transformation']",https://www.coursera.org/specializations/generative-ai-for-everyone
Microsoft Back-End Developer Professional Certificate,Microsoft,Mobile and Web Development,Launch your Career in Back-End Development. Start your journey as a back-end developer. Develop job-ready AI-powered skills and earn a certificate from Microsoft. No prior experience is required.,4.7,Beginner level,6 months,"['Authentications', 'Continuous Integration', 'Graph Theory', 'Application Deployment', 'Role-Based Access Control (RBAC)', 'Debugging', 'SQL', 'Database Management', 'CI/CD', 'C# (Programming Language)', '.NET Framework']",https://www.coursera.org/professional-certificates/microsoft-back-end-developer
Preparing for Google Cloud Certification: Cloud Engineer Professional Certificate,Google Cloud,Cloud Computing,Start your career in the cloud.,4.8,Intermediate level,1 month,"['Containerization', 'Identity and Access Management', 'Cloud Computing', 'Network Infrastructure', 'Application Deployment', 'Prompt Engineering', 'Cloud Storage', 'Cloud Infrastructure']",https://www.coursera.org/professional-certificates/cloud-engineering-gcp
IBM Java Developer Professional Certificate,IBM,Software Development,Prepare for a career as a Java developer. Gain the in-demand skills and hands-on experience to get job-ready in 3 months. No prior experience required.,4.8,Beginner level,3 months,"['Database Design', 'Containerization', 'Development Environment', 'GitHub', 'Software Architecture', 'Cloud-Native Computing', 'Microservices', 'Software Development', 'Cascading Style Sheets (CSS)']",https://www.coursera.org/professional-certificates/java-developer
AI & Law,Lund University,Law,"Instructors: Jeffery Atik
+8 more",4.7,Beginner level,Flexible schedule,"['Law, Regulation, and Compliance', 'Legal Research', 'Intellectual Property', 'Public Administration', 'Healthcare Industry Knowledge', 'Legal Proceedings', 'Artificial Intelligence', 'Innovation']",https://www.coursera.org/learn/ai-law
Digital Product Management Specialization,University of Virginia,Design and Product,Implement a modern approach to product management. Master the fundamentals that create great teams and products,4.8,Beginner level,1 month,"['Usability Testing', 'Customer Analysis', 'Continuous Delivery', 'Agile Project Management', 'New Product Development', 'Agile Software Development', 'Team Management', 'Innovation', 'Product Testing']",https://www.coursera.org/specializations/uva-darden-digital-product-management
Microsoft Excel Professional Certificate,Microsoft,Data Analysis,"Develop Excel Skills from Microsoft. Develop your data analysis skills in Excel with AI-driven Copilot, hands-on projects, and expert guidance to accelerate your career.",4.2,Beginner level,3 months,"['Data Visualization Software', 'Forecasting', 'Dashboard', 'Pivot Tables And Charts', 'Prompt Engineering', 'Excel Formulas', 'Data Cleansing', 'Microsoft Excel', 'Data Processing', 'Data Manipulation']",https://www.coursera.org/professional-certificates/microsoft-excel-skills
Workday in Action Series,Workday,Business Essentials,Instructor: Workday Education,4.8,Beginner level,9 hours to complete,"['Benefits Administration', 'Accounts Payable and Receivable', 'Human Capital', 'Recruitment', 'Business Process Management', 'Workday (Software)', 'Accounting Software', 'Payroll', 'Human Resources Software']",https://www.coursera.org/learn/workday-in-action-series
Generative AI for Data Analysts Specialization,IBM,Data Analysis,Build generative AI skills for data analytics. Enhance your career as a data analyst with knowledge of generative AI! No prior experience necessary.,4.8,Intermediate level,2 months,"['Data Visualization Software', 'Dashboard', 'Large Language Modeling', 'ChatGPT', 'OpenAI', 'IBM Cloud', 'Prompt Engineering', 'Image Analysis', 'Artificial Intelligence and Machine Learning (AI/ML)', 'SQL', 'Analytics']",https://www.coursera.org/specializations/generative-ai-for-data-analysts
IBM Back-end JavaScript Developer Professional Certificate,IBM,Software Development,Launch your Back-End JavaScript Developer career. Build the skills and hands-on experience to get job-ready in under four months. No degree or prior experience required.,4.7,Beginner level,4 months,"['Containerization', 'Development Environment', 'OpenShift', 'Ajax', 'Software Architecture', 'Javascript', 'Cloud-Native Computing', 'Azure DevOps', 'Application Deployment', 'Software Development']",https://www.coursera.org/professional-certificates/backend-javascript-developer
