Title,Partner,Subject,Description,Rating,Level,Duration (in hour),Skills,URL
meta database engineer professional certificate,Meta,Data Management,launch career database engineer build jobready skill indemand career earn credential meta degree experience required get started,4.6,Beginner level,240.0,database design github database management system database administration database system unix command database sql database management data modeling mysql workbench version control,https://www.coursera.org/professional-certificates/meta-database-engineer
introduction corporate finance,University of Pennsylvania,Finance,course part multiple program learn,4.6,Beginner level,7.0,working capital financial management risk analysis cash flow asset management business valuation cash flow forecasting financial modeling financial planning financial analysis,https://www.coursera.org/learn/wharton-finance
ibm applied devops engineering professional certificate,IBM,Software Development,advance career high demand field devops build software development skill latest devops concept tool technology get job ready less month,4.7,Intermediate level,120.0,openshift continuous integration cloudnative computing cloud application application deployment agile software development istio test driven development tdd,https://www.coursera.org/professional-certificates/ibm-applied-devops-engineering
ibm io android mobile app developer professional certificate,IBM,Mobile and Web Development,get jobready mobile app developer build io android mobile app development skill practical experience employer look month programming experience needed,4.7,Beginner level,200.0,development environment reactjs github software architecture apple io react native cascading style sheet cs prompt engineering react redux flutter software user centered design,https://www.coursera.org/professional-certificates/ibm-ios-android-mobile-app-developer-pc
aws cloud support associate professional certificate,Amazon Web Services,Cloud Computing,launch career cloud computing build jobready skill gain credential go beginner jobready month less degree prior experience required,4.8,Beginner level,120.0,linux command software architecture cloud computing technical support customer relationship management root cause analysis web application aws identity access management iam,https://www.coursera.org/professional-certificates/aws-cloud-support-associate
generative ai assistant specialization,Vanderbilt University,Machine Learning,generative ai build train personalized assistant generative ai,4.9,Beginner level,40.0,creative thinking brainstorming verification validation large language modeling ideation productivity chatgpt data validation prompt engineering risk management framework innovation,https://www.coursera.org/specializations/generative-ai-assistants
preparatory certificate finance financial market specialization,Corporate Finance Institute,Finance,understanding finance financial market learner gain comprehensive knowledge skill financial market corporate finance accounting investment strategy risk management esg principle,4.7,Beginner level,40.0,balance sheet business valuation wealth management corporate finance financial statement analysis annual report accounting loan banking service enterprise risk management erm banking,https://www.coursera.org/specializations/finance-and-financial-markets
introduction electronics,Georgia Institute of Technology,Electrical Engineering,introduction electronics,4.7,Beginner level,45.0,basic electrical system electronic component schematic diagram engineering analysis electronics engineering electronics semiconductor,https://www.coursera.org/learn/electronics
ibm full stack software developer professional certificate,IBM,Cloud Computing,prepare career full stack developer build jobready skill musthave ai skill indemand career earn credential ibm,4.6,Beginner level,40.0,fullstack web development software architecture cloud computing flask web framework cloudnative computing application deployment software development cascading style sheet cs,https://www.coursera.org/professional-certificates/ibm-full-stack-cloud-developer
private equity venture capital,Università Bocconi,Finance,private equity venture capital,4.8,Beginner level,40.0,investment entrepreneurship business valuation private equity tax law capital market legal risk cash flow entrepreneurial finance financial management due diligence merger acquisition,https://www.coursera.org/learn/private-equity
generative ai mobile app developer specialization,IBM,Mobile and Web Development,fasttrack career jobready genai skill master genaipowered mobile app development build practical experience employer looking month,4.8,Advanced level,40.0,machine learning method application security large language modeling chatgpt openai cloud application ibm cloud software development natural language processing prompt engineering,https://www.coursera.org/specializations/generative-ai-for-mobile-app-developers
ai medicine specialization,DeepLearning.AI,Machine Learning,ai medicine specialization,4.7,Intermediate level,80.0,risk modeling machine learning machine learning method precision medicine applied machine learning random forest algorithm patient treatment image analysis decision tree learning,https://www.coursera.org/specializations/ai-for-medicine
fundamental quantitative modeling,University of Pennsylvania,Business Essentials,course part multiple program learn,4.6,Beginner level,7.0,predictive analytics business mathematics regression analysis probability probability distribution statistical modeling business modeling forecasting statistic process optimization,https://www.coursera.org/learn/wharton-quantitative-modeling
neural network deep learning,DeepLearning.AI,Machine Learning,course part deep learning specialization,4.9,Intermediate level,40.0,supervised learning python programming machine learning artificial intelligence performance tuning calculus deep learning artificial neural network linear algebra,https://www.coursera.org/learn/neural-networks-deep-learning
project initiation starting successful project,Google,Leadership and Management,course part google project management professional certificate,4.8,Beginner level,40.0,stakeholder management strategic thinking resource management accountability goal setting cost benefit analysis business writing project management software project management,https://www.coursera.org/learn/project-initiation-google
understanding brain neurobiology everyday life,The University of Chicago,Basic Science,understanding brain neurobiology everyday life,4.9,Beginner level,40.0,anatomy neurology blood pressure behavioral health human development mental behavioral health mental health disease disorder respiration biology psychology vital sign,https://www.coursera.org/learn/neurobiology
microsoft project management professional certificate,Microsoft,Business Strategy,launch career project manager build jobready skill prepare project management professional pmp certification exam prior experience required,4.7,Beginner level,160.0,project management virtual team performance measurement project schedule project management life cycle team management excel formula planning procurement kanban principle,https://www.coursera.org/professional-certificates/microsoft-project-management
introduction negotiation strategic playbook becoming principled persuasive negotiator,Yale University,Business Essentials,introduction negotiation strategic playbook becoming principled persuasive negotiator,4.8,Beginner level,33.0,relationship building communication persuasive communication mediation strategic decisionmaking conflict management collaboration game theory contract negotiation influencing negotiation,https://www.coursera.org/learn/negotiation
project execution running project,Google,Leadership and Management,course part google project management professional certificate,4.8,Beginner level,40.0,strategic thinking team management project control continuous improvement process quality management project documentation stakeholder communication project management life cycle,https://www.coursera.org/learn/project-execution-google
attract engage customer digital marketing,Google,Marketing,course part google digital marketing ecommerce professional certificate,4.8,Beginner level,40.0,digital advertising advertising campaign google analytics online advertising keyword research google ad search engine optimization digital marketing marketing strategy marketing,https://www.coursera.org/learn/attract-and-engage-customers
ibm data analytics excel r professional certificate,IBM,Data Analysis,prepare career data analytics gain indemand skill handson experience get jobready less month prior experience required,4.7,Beginner level,40.0,ibm cognos analytics database design data visualization software data wrangling dashboard big data exploratory data analysis excel formula microsoft excel data mining data manipulation,https://www.coursera.org/professional-certificates/ibm-data-analyst-r-excel
speed data analysis presentation building,Google,Machine Learning,course part google prompting essential specialization,4.8,Beginner level,40.0,prompt engineering data analysis data presentation graphing oral expression data visualization data storytelling,https://www.coursera.org/learn/google-speed-up-data-analysis-and-presentation-building
google cybersecurity professional certificate,Google,Computer Security and Networks,get fast track career cybersecurity certificate program youll learn indemand skill get ai training google expert learn pace degree experience required,4.8,Beginner level,40.0,interviewing skill threat management cybersecurity intrusion detection prevention computer security incident management linux debugging sql incident response hardening,https://www.coursera.org/professional-certificates/google-cybersecurity
microsoft fullstack developer professional certificate,Microsoft,Mobile and Web Development,launch career fullstack development start journey fullstack developer develop jobready aipowered skill earn certificate microsoft experience required,4.6,Beginner level,360.0,html cs authentication fullstack web development continuous integration github graph theory application deployment rolebased access control rbac debugging sql cicd,https://www.coursera.org/professional-certificates/microsoft-full-stack-developer
introduction finance accounting specialization,University of Pennsylvania,Finance,learn basic finance accounting build foundation core business skill finance accounting,4.4,Beginner level,40.0,balance sheet business valuation working capital capital budgeting corporate finance financial statement analysis accounting cash flow financial analysis financial accounting,https://www.coursera.org/specializations/finance-accounting
unsupervised learning recommenders reinforcement learning,DeepLearning.AI,Machine Learning,course part machine learning specialization,4.9,Beginner level,40.0,statistical machine learning applied machine learning machine learning algorithm deep learning anomaly detection machine learning method unsupervised learning,https://www.coursera.org/learn/unsupervised-learning-recommenders-reinforcement-learning
programming everybody getting started python,University of Michigan,Software Development,course part python everybody specialization,4.8,Beginner level,40.0,python programming scripting scripting language computational thinking programming principle development environment computer programming,https://www.coursera.org/learn/python
asset threat vulnerability,Google,Computer Security and Networks,course part google cybersecurity professional certificate,4.8,Beginner level,40.0,risk management framework authentication threat detection threat modeling threat management nist vulnerability assessment mitre attck framework cyber threat intelligence,https://www.coursera.org/learn/assets-threats-and-vulnerabilities
medical billing coding fundamental specialization,MedCerts,Health Informatics,gain medical billing coding fundamental prepare career medical billing industry gaining understanding language insurance revenue cycle,4.8,Beginner level,40.0,health care procedure regulation electronic medical record cultural diversity payment processing medical billing coding health information management medical record anatomy,https://www.coursera.org/specializations/medical-billing-coding-fundamentals
google cloud data analytics professional certificate,Google Cloud,Cloud Computing,launch career cloud data analytics build indemand skill gain credential go beginner jobready week less degree prior experience required,4.5,Beginner level,40.0,data visualization software dashboard cloud computing data cleansing cloud storage cloud infrastructure database management data governance google cloud platform data transformation,https://www.coursera.org/professional-certificates/google-cloud-data-analytics-certificate
supervised machine learning regression classification,DeepLearning.AI,Machine Learning,course part machine learning specialization,4.9,Beginner level,40.0,unsupervised learning predictive modeling scikit learn machine learning library python programming feature engineering machine learning classification regression tree cart,https://www.coursera.org/learn/machine-learning
stanford introduction food health,Stanford University,Nutrition,stanford introduction food health,4.7,Beginner level,40.0,public health disease prevention nutrition diet chronic disease cooking health informatics food beverage clinical nutrition behavioral health preventative care,https://www.coursera.org/learn/food-and-health
tool trade linux sql,Google,Computer Security and Networks,course part google cybersecurity professional certificate,4.8,Beginner level,40.0,file system relational database unix authentication user account commandline interface sql operating system database management linux authorization computing linux command,https://www.coursera.org/learn/linux-and-sql
leading people team specialization,University of Michigan,Leadership and Management,leading effectively learn proven management technique four course,4.8,Beginner level,40.0,persuasive communication teamwork performance review interviewing skill team motivation talent management talent recruitment employee engagement team management employee coaching,https://www.coursera.org/specializations/leading-teams
meta frontend developer professional certificate,Meta,Mobile and Web Development,launch career frontend developer build jobready skill indemand career earn credential meta degree prior experience required get started,4.7,Beginner level,40.0,html cs usability testing reactjs github user experience design javascript persona user experience interaction design cascading style sheet cs frontend web development,https://www.coursera.org/professional-certificates/meta-front-end-developer
ibm backend development professional certificate,IBM,Software Development,prepare career backend developer gain indemand skill handson experience get jobready less month,4.7,Beginner level,240.0,linux command objectrelational mapping software architecture flask web framework cloudnative computing microservices application deployment shell script istio,https://www.coursera.org/professional-certificates/ibm-backend-development
ibm project manager professional certificate,IBM,Leadership and Management,launch career project manager get jobready prep certified associate project management capm certification exam,4.8,Beginner level,160.0,development environment interviewing skill software architecture project management stakeholder engagement resource management project risk management agile software development,https://www.coursera.org/professional-certificates/ibm-it-project-manager
digital marketing specialization,University of Illinois Urbana-Champaign,Marketing,drive customer behavior online sixcourse overview latest digital marketing skill taught industry expert,4.6,Beginner level,160.0,digital advertising content marketing digital medium strategy marketing communication google analytics marketing analytics marketing analytics email marketing digital marketing,https://www.coursera.org/specializations/digital-marketing
introduction statistic,Stanford University,Data Analysis,introduction statistic,4.6,Beginner level,40.0,statistical modeling data analysis exploratory data analysis quantitative research data collection probability distribution statistical method sampling statistic regression analysis,https://www.coursera.org/learn/stanford-statistics
google prompting essential specialization,Google,Machine Learning,unlock ai potential effective prompt learn google expert use ai effectively writing clear specific prompt,4.8,Beginner level,40.0,document management machine learning graphing ideation solution design chatgpt report writing prompt engineering business correspondence taking meeting minute critical thinking,https://www.coursera.org/specializations/prompting-essentials-google
generative ai educator specialization,IBM,Education,reinvent teaching gen aipowered innovation learn leverage gen ai tool transform education training drive excellent learning experience week,4.9,Beginner level,40.0,data security virtual environment large language modeling chatgpt openai ibm cloud prompt engineering image analysis education software technology emerging technology,https://www.coursera.org/specializations/generative-ai-educators
analyze data answer question,Google,Data Analysis,course part google data analytics professional certificate,4.6,Beginner level,40.0,pivot table chart data integration data transformation analytics excel formula data validation data compilation sql data analysis user feedback spreadsheet software data manipulation,https://www.coursera.org/learn/analyze-data
build wireframes lowfidelity prototype,Google,Design and Product,course part google ux design professional certificate,4.9,Beginner level,40.0,user story information architecture user experience design figma design software prototyping user centered design storyboarding user interface ui mockups wireframing usability,https://www.coursera.org/learn/wireframes-low-fidelity-prototypes
preparing google cloud certification cloud developer professional certificate,Google Cloud,Cloud Computing,developer best practice google cloud,4.7,Intermediate level,80.0,containerization identity access management cloud computing microservices cloud application application deployment prompt engineering debugging cloud storage cloud infrastructure cicd,https://www.coursera.org/professional-certificates/google-cloud-developer
google business intelligence professional certificate,Google,Data Analysis,learn indemand skill like data modeling data visualization dashboarding reporting less month,4.8,Advanced level,40.0,database design interviewing skill dashboard stakeholder engagement professional development data integrity tableau software business analysis business process stakeholder communication,https://www.coursera.org/professional-certificates/google-business-intelligence
microsoft support specialist professional certificate,Microsoft,Support and Operations,launch career support specialist build jobready skill musthave ai skill indemand career earn credential microsoft prior experience required,4.8,Beginner level,120.0,collaborative software system support application security cloud computing cybersecurity technical support microsoft team microsoft computer hardware network troubleshooting,https://www.coursera.org/professional-certificates/microsoft-it-support-specialist
data science foundation specialization,University of London,Data Analysis,unlock academic career success data science build foundational knowledge handson skill need forge new career opportunity technical experience required,4.7,Beginner level,120.0,machine learning algorithm machine learning data visualization software project management dashboard unsupervised learning panda python package numpy pseudocode data mining,https://www.coursera.org/specializations/data-science-foundations
ibm data architecture professional certificate,IBM,Data Management,launch career data architect learn indemand skill like data engineering database management data architecture less month,4.7,Beginner level,160.0,database design data security linux command database administration data store sql database management apache hadoop data migration nosql data governance data warehousing,https://www.coursera.org/professional-certificates/ibm-data-architect
machine learning google cloud specialization,Google Cloud,Machine Learning,learn machine learning google cloud realworld experimentation endtoend ml,4.6,Intermediate level,40.0,machine learning kera neural network library mlops machine learning operation workflow management applied machine learning cloud computing application deployment prompt engineering,https://www.coursera.org/specializations/machine-learning-tensorflow-gcp
ibm introduction machine learning specialization,IBM,Data Analysis,learn machine learning real use case build skill career one relevant field modern ai handson project curriculum ibms expert,4.7,Intermediate level,80.0,machine learning algorithm statistical modeling machine learning applied machine learning unsupervised learning exploratory data analysis classification regression tree cart,https://www.coursera.org/specializations/ibm-intro-machine-learning
applied software engineering fundamental specialization,IBM,Software Development,build foundation career software develop handson experience git github linux python learn fundamental software engineering,4.7,Beginner level,40.0,development environment unit testing linux command github software architecture file management flask web framework application deployment shell script linux engineering software,https://www.coursera.org/specializations/software-engineering-fundamentals
google cloud digital leader training professional certificate,Google Cloud,Cloud Computing,gain foundational literacy cloud digital transformation increase cloud confidence speak colleague technical cloud role contribute informed cloudrelated business decision,4.8,Beginner level,40.0,data security big data cloud computing digital transformation cloud infrastructure cloud management data governance google cloud platform data warehousing serverless computing,https://www.coursera.org/professional-certificates/google-cloud-digital-leader-training
generative ai data analyst specialization,Vanderbilt University,Data Analysis,become generative ai data analyst learn use chatgpt generative ai tool analyze data automate workflow communicate insight clarity impact,4.8,Beginner level,40.0,document management data integration large language modeling data synthesis pivot table chart productivity chatgpt prompt engineering excel formula data cleansing database sql,https://www.coursera.org/specializations/generative-ai-data-analyst
introduction programming python java specialization,University of Pennsylvania,Software Development,boost computer programming skill minimal previous exposure learn two popular programming language accelerated pace,4.5,Beginner level,80.0,java unit testing programming principle data visualization software eclipse software matplotlib pivot table chart panda python package java programming debugging data cleansing,https://www.coursera.org/specializations/programming-python-java
gemini google workspace specialization,Google Cloud,Cloud Computing,use generative ai feature google workspace learn use generative ai gemini google workspace improve productivity efficiency,4.6,Beginner level,40.0,storytelling video production multimedia project management google workspace medium production workflow management writing prompt engineering video editing google sheet collaboration,https://www.coursera.org/specializations/gemini-for-google-workspace
prompt engineering chatgpt,Vanderbilt University,Machine Learning,course part multiple program learn,4.8,Beginner level,40.0,large language modeling productivity problem solving chatgpt collaboration creative thinking prompt engineering ingenuity brainstorming generative ai application development,https://www.coursera.org/learn/prompt-engineering
introduction data science specialization,IBM,Data Analysis,launch career data science gain foundational data science skill prepare career advanced learning data science,4.7,Beginner level,40.0,data analysis software github big data cloud computing business analysis data cleansing database sql data mining query language data literacy peer review,https://www.coursera.org/specializations/introduction-data-science
introduction marketing,University of Pennsylvania,Marketing,course part business foundation specialization,4.8,Beginner level,10.0,brand strategy customer experience strategy cx brand awareness marketing communication customer insight marketing price negotiation communication strategy brand loyalty,https://www.coursera.org/learn/wharton-marketing
generative ai fundamental specialization,IBM,Machine Learning,unlock leverage potential generative ai learn use capability generative ai enhance work daily life,4.7,Beginner level,40.0,large language modeling chatgpt artificial neural network openai ibm cloud prompt engineering leadership management business development deep learning business transformation,https://www.coursera.org/specializations/generative-ai-for-everyone
