Title,Partner,Subject,Description,Rating,Level,Duration,Skills,URL
Play It Safe: Manage Security Risks,Google,Computer Security and Networks,This course is part of Google Cybersecurity Professional Certificate,4.8,Beginner level,Flexible schedule,"['Incident Response', 'Business Risk Management', 'Security Controls', 'Risk Management', 'Cybersecurity', 'Vulnerability Management', 'Threat Management', 'Auditing', 'Enterprise Security', 'Risk Management Framework']",https://www.coursera.org/learn/manage-security-risks
SAP Technology Consultant Professional Certificate,SAP,Leadership and Management,"Unlock your potential in SAP Consulting. Build the core skills SAP Partners and customers are searching for across the world, and kick-start an exciting SAP career.",4.7,Beginner level,7 months,"['Technical Design', 'Project Management', 'Stakeholder Engagement', 'Cloud Computing', 'Cybersecurity', 'Technical Consulting', 'Solution Design', 'Professional Networking', 'Digital Transformation']",https://www.coursera.org/professional-certificates/sap-technology-consultant
Instructional Design Foundations and Applications,University of Illinois Urbana-Champaign,Education,Instructor: Eunjung Grace Oh,4.0,,12 hours to complete,"['Instructional Design', 'Diversity and Inclusion', 'Instructional and Curriculum Design', 'Job Analysis', 'Analysis', 'Education and Training', 'Learning Theory', 'Systems Analysis', 'Needs Assessment']",https://www.coursera.org/learn/instructional-design-foundations-applications
Introduction to Engineering Mechanics,Georgia Institute of Technology,Mechanical Engineering,"Instructor: Dr. Wayne Whiteman, PE",4.8,,14 hours to complete,"['Mechanical Engineering', 'Civil Engineering', 'Mechanics', 'Trigonometry', 'Engineering', 'Structural Analysis', 'Engineering Calculations', 'Engineering Analysis', 'Torque (Physics)']",https://www.coursera.org/learn/engineering-mechanics-statics
Artificial Intelligence in Marketing,University of Virginia,Marketing,Instructor: Rajkumar Venkatesan,4.6,Beginner level,Flexible schedule,"['Marketing Strategies', 'Network Analysis', 'Data-Driven Decision-Making', 'Marketing Analytics', 'Artificial Intelligence', 'Customer experience improvement', 'Digital Marketing', 'Algorithms']",https://www.coursera.org/learn/uva-darden-artificial-intelligence-marketing
Amazon Junior Software Developer Professional Certificate,Amazon,Software Development,Launch your career as a Junior Software Developer. Build job-ready skills for an in-demand career in software development in as little as 4 months. No prior experience or degree required to get started.,4.7,Beginner level,4 months,"['Full-Stack Web Development', 'Systems Development', 'Software Development', 'JUnit', 'Java Programming', 'Digital Transformation', 'Test Driven Development (TDD)', 'Requirements Analysis', 'SQL', 'Database Management']",https://www.coursera.org/professional-certificates/amazon-junior-software-developer
Advanced Learning Algorithms,DeepLearning.AI,Machine Learning,This course is part of Machine Learning Specialization,4.9,Beginner level,Flexible schedule,"['Performance Tuning', 'Tensorflow', 'Machine Learning', 'Artificial Intelligence', 'Data Ethics', 'Random Forest Algorithm', 'Machine Learning Algorithms', 'Decision Tree Learning', 'Deep Learning']",https://www.coursera.org/learn/advanced-learning-algorithms
The Materiality of ESG Factors Specialization,University of Pennsylvania,Finance,Learn about ESG Factors When Investing. Analyze the importance of ESG investing. Identify how the ESG approach should be an essential piece of your strategy based on various factors impacting and driving value.,4.7,Beginner level,1 month,"['Financial Data', 'Governance', 'Environmental Resource Management', 'Investment Management', 'Waste Minimization', 'Insurance', 'Investments', 'Environmental Social And Corporate Governance (ESG)']",https://www.coursera.org/specializations/materiality-esg-factors
IBM AI Product Manager Professional Certificate,IBM,Support and Operations,Launch your career as an AI Product Manager. Build in-demand product management and generative AI skills to get job ready in 3 months or less.,4.6,Beginner level,3 months,"['Product Planning', 'Product Lifecycle Management', 'Stakeholder Engagement', 'Product Roadmaps', 'ChatGPT', 'New Product Development', 'OpenAI', 'Prompt Engineering', 'Project Management Life Cycle', 'Innovation']",https://www.coursera.org/professional-certificates/ibm-ai-product-manager
Dynamic Public Speaking Specialization,University of Washington,Personal Development,Become an Excellent Public Speaker. Master techniques for designing and delivering clear and compelling presentations.,4.8,Beginner level,2 months,"['Constructive Feedback', 'Storytelling', 'Verbal Communication Skills', 'Persuasive Communication', 'Communication Strategies', 'Writing', 'Microsoft PowerPoint', 'Presentations', 'Public Speaking']",https://www.coursera.org/specializations/public-speaking
Meta Back-End Developer Professional Certificate,Meta,Mobile and Web Development,Launch your career as a back-end developer. Build job-ready skills for an in-demand career and earn a credential from Meta. No degree or prior experience required to get started.,4.7,Beginner level,Flexible schedule,"['Database Design', 'Full-Stack Web Development', 'GitHub', 'Database Management Systems', 'Web Design and Development', 'Front-End Web Development', 'Unix Commands', 'SQL', 'Django (Web Framework)']",https://www.coursera.org/professional-certificates/meta-back-end-developer
AWS Generative AI Applications Professional Certificate,Amazon Web Services,Cloud Computing,Building AI Applications on AWS Cloud. Learn AI fundamentals and AWS services to develop practical applications to enhance productivity,4.7,Beginner level,1 month,"['AWS SageMaker', 'Cost Management', 'Large Language Modeling', 'MLOps (Machine Learning Operations)', 'Public Cloud', 'Prompt Engineering', 'Artificial Intelligence and Machine Learning (AI/ML)']",https://www.coursera.org/professional-certificates/aws-generative-ai-applications
Agentic AI and AI Agents for Leaders Specialization,Vanderbilt University,Leadership and Management,Strategic Insights for Leaders on Agentic AI. Gain the knowledge to lead AI innovation in your organization by understanding Agentic AI and AI Agents.,4.8,Beginner level,1 month,"['Creative Thinking', 'Large Language Modeling', 'Workflow Management', 'Agentic systems', 'Automation', 'Productivity', 'Technology Strategies', 'ChatGPT', 'Prompt Engineering']",https://www.coursera.org/specializations/ai-agents-for-leaders
The Business of Health Care Specialization,University of Pennsylvania,Healthcare Management,Advance your career in health care management. Develop business skills and understand the American health care system to improve cost and quality.,4.7,Beginner level,1 month,"['Employee Performance Management', 'Health Care Procedure and Regulation', 'Decision Making', 'People Management', 'Health Systems', 'Process Improvement and Optimization', 'Performance Improvement']",https://www.coursera.org/specializations/healthcare-administration-management
Data Structures and Algorithms Specialization,University of California San Diego,Algorithms,"Master Algorithmic Programming Techniques. Advance your Software Engineering or Data Science Career by Learning Algorithms through Programming and Puzzle Solving. Ace coding interviews by implementing each algorithmic challenge in this Specialization. Apply the newly-learned algorithmic techniques to real-life problems, such as analyzing a huge social network or sequencing a genome of a deadly pathogen.",4.6,Intermediate level,5 months,"['Network Model', 'Programming Principles', 'Computational Thinking', 'Graph Theory', 'Test Engineering', 'Network Routing', 'Debugging', 'Network Analysis', 'Epidemiology', 'Operations Research', 'Bioinformatics']",https://www.coursera.org/specializations/data-structures-algorithms
Business Analytics Specialization,University of Pennsylvania,Data Analysis,Make Data-Driven Business Decisions. Achieve fluency in business data strategies in four discipline-specific courses.,4.6,Beginner level,1 month,"['Financial Data', 'Customer Analysis', 'Workforce Planning', 'Descriptive Analytics', 'Business Analytics', 'Demand Planning', 'Talent Management', 'Financial Statement Analysis', 'Human Resource Strategy', 'Analytics']",https://www.coursera.org/specializations/business-analytics
Construction Management Specialization,Columbia University,Leadership and Management,Construction Project Management and Planning. Develop and understand the foundations of project planning and scheduling techniques,4.8,Beginner level,3 months,"['Building Information Modeling', 'Construction Estimating', 'Cost Control', 'Construction', 'Project Schedules', 'Project Risk Management', 'Bidding', 'Cost Estimation', 'Innovation', 'Project Closure', 'Project Finance']",https://www.coursera.org/specializations/construction-management
IBM Machine Learning Professional Certificate,IBM,Machine Learning,Prepare for a career in machine learning. Gain the in-demand skills and hands-on experience to get job-ready in less than 3 months.,4.6,Intermediate level,3 months,"['Machine Learning Algorithms', 'Machine Learning', 'Applied Machine Learning', 'Unsupervised Learning', 'Exploratory Data Analysis', 'Supervised Learning', 'Data Processing', 'Regression Analysis', 'Deep Learning']",https://www.coursera.org/professional-certificates/ibm-machine-learning
Security in Google Cloud Specialization,Google Cloud,Security,"Launch your career in Cloud Security. This self-paced Specialization gives a broad study of security controls, best practices, and techniques on Google Cloud.",4.7,Intermediate level,1 month,"['Data Security', 'Containerization', 'Security Controls', 'Identity and Access Management', 'Threat Management', 'Application Security', 'Cloud Computing', 'Data Loss Prevention', 'Application Deployment']",https://www.coursera.org/specializations/security-google-cloud-platform
DeepLearning.AI Data Analytics Professional Certificate,DeepLearning.AI,Data Analysis,"Develop a Robust Foundation in Data Analytics. Build a job-ready data analytics skillset using industry-standard tools, including generative AI, to extract insights, make decisions, and solve real-world business problems.",4.7,Beginner level,4 months,"['Statistics', 'Dashboard', 'Large Language Modeling', 'Tableau Software', 'Pandas (Python Package)', 'LinkedIn', 'Data Validation', 'Descriptive Statistics', 'Google Sheets', 'Data Literacy', 'Data Storytelling']",https://www.coursera.org/professional-certificates/data-analytics
Introduction to Systematic Review and Meta-Analysis,Johns Hopkins University,Research,"Instructors: Tianjing Li, MD, MHS, PHD
+1 more",4.8,,14 hours to complete,"['Biostatistics', 'Analysis', 'Scientific Methods', 'Statistical Methods', 'Data Collection', 'Research Methodologies', 'Clinical Trials', 'Epidemiology', 'Data Synthesis', 'Statistical Analysis', 'Clinical Research']",https://www.coursera.org/learn/systematic-review
Foundations of Positive Psychology Specialization,University of Pennsylvania,Business Essentials,Positive Psychology: Well-being for life. Master strategies and tools that enable individuals and organizations to thrive,4.8,Beginner level,2 months,"['Qualitative Research', 'Self-Awareness', 'Research Design', 'Positivity', 'Optimism', 'Research', 'Scientific Methods', 'Productivity', 'Self-Motivation', 'Relationship Building', 'Goal Setting', 'Cognitive flexibility']",https://www.coursera.org/specializations/positivepsychology
Prompt Engineering Specialization,Vanderbilt University,Machine Learning,"Become a Prompt Engineering Expert. Master prompt engineering patterns, techniques, and approaches to effectively leverage Generative AI",4.8,Beginner level,1 month,"['Document Management', 'Creative Thinking', 'Brainstorming', 'Verification And Validation', 'Large Language Modeling', 'Ideation', 'Productivity', 'ChatGPT', 'Data Validation', 'Prompt Engineering']",https://www.coursera.org/specializations/prompt-engineering
IBM and ISC2 Cybersecurity Specialist Professional Certificate,IBM,Security,Get job-ready to launch your cybersecurity career. Build the information security skills and hands-on experience employers look for in less than 4 months. No prior experience required.,4.8,Beginner level,Flexible schedule,"['Governance', 'Security Controls', 'Application Security', 'Cryptography', 'Cybersecurity', 'Peripheral Devices', 'Computer Security Incident Management', 'Network Troubleshooting', 'Cloud Computing Architecture']",https://www.coursera.org/professional-certificates/ibm-isc2-cybersecurity-specialist
"JavaScript Programming with React, Node & MongoDB Specialization",IBM,Software Development,Discover your JavaScript developer potential. Solidify your cloud application developer skills with essential JavaScript technologies and NoSQL databases,4.5,Beginner level,2 months,"['Authentications', 'Full-Stack Web Development', 'React.js', 'UI Components', 'Ajax', 'Javascript', 'JavaScript Frameworks', 'Web Applications', 'Application Deployment', 'Server Side', 'Front-End Web Development']",https://www.coursera.org/specializations/javascript-programming-with-react-node-mongodb
Google AI Essentials Specialization,Google,Machine Learning,Boost Your Productivity with AI Tools. New to AI? Learn from Google experts how AI can help you speed up daily tasks and spark new ideas.,4.8,Beginner level,1 month,"['Data Security', 'Machine Learning Software', 'Large Language Modeling', 'Prompt Engineering', 'Digital Transformation', 'Artificial Intelligence and Machine Learning (AI/ML)', 'Innovation']",https://www.coursera.org/specializations/ai-essentials-google
Deep Learning Specialization,DeepLearning.AI,Machine Learning,Become a Machine Learning expert. Master the fundamentals of deep learning and break into AI. Recently updated with cutting-edge techniques!,4.9,Intermediate level,Flexible schedule,"['Machine Learning Algorithms', 'Machine Learning', 'Keras (Neural Network Library)', 'Large Language Modeling', 'Applied Machine Learning', 'PyTorch (Machine Learning Library)', 'Artificial Neural Networks']",https://www.coursera.org/specializations/deep-learning
Google Cloud Database Engineer Specialization,Google Cloud,Cloud Computing,Advance your cloud career in database engineering,4.7,Intermediate level,1 month,"['Containerization', 'Identity and Access Management', 'Database Administration', 'Cloud Applications', 'Application Deployment', 'Operational Databases', 'Prompt Engineering', 'Cloud Storage']",https://www.coursera.org/specializations/google-cloud-database-engineer
Generative AI Automation Specialization,Vanderbilt University,Machine Learning,Generative AI Mastery: Automate with ChatGPT. Learn to perform complex tasks effortlessly using the power of generative AI,4.9,Beginner level,1 month,"['Document Management', 'Verification And Validation', 'Large Language Modeling', 'Data Synthesis', 'Ideation', 'Productivity', 'ChatGPT', 'OpenAI', 'Data Validation', 'Prompt Engineering', 'Risk Management Framework']",https://www.coursera.org/specializations/generative-ai-automation
Python for Everybody Specialization,University of Michigan,Software Development,"Learn to Program and Analyze Data with Python. Develop programs to gather, clean, analyze, and visualize data.",4.8,Beginner level,Flexible schedule,"['Database Design', 'Programming Principles', 'Database Systems', 'SQL', 'Database Management', 'Data Processing', 'Data Collection', 'Extensible Markup Language (XML)', 'Data Modeling', 'Data Visualization']",https://www.coursera.org/specializations/python
Use AI Responsibly,Google,Machine Learning,This course is part of Google AI Essentials Specialization,4.9,Beginner level,Flexible schedule,"['Generative AI', 'Data Security', 'Critical Thinking', 'Analysis']",https://www.coursera.org/learn/google-use-ai-responsibly
Intellectual Property Law Specialization,University of Pennsylvania,Business Strategy,Become fluent in the rules of the new economy. Learn how to use intellectual property law to protect and maximize the value of your innovations,4.8,Intermediate level,1 month,"['Regulation and Legal Compliance', 'Business Valuation', 'Creativity', 'Business Strategy', 'Intellectual Property', 'Brand Awareness', 'Innovation', 'Planning', 'Marketing', 'Asset Protection', 'Asset Management']",https://www.coursera.org/specializations/introduction-intellectual-property
Python 3 Programming Specialization,University of Michigan,Software Development,Become a Fluent Python Programmer. Learn the fundamentals and become an independent programmer.,4.8,Beginner level,3 months,"['Unit Testing', 'Programming Principles', 'File Management', 'Image Analysis', 'Debugging', 'Data Processing', 'Data Manipulation', 'Maintainability', 'Data Import/Export', 'Computer Programming', 'Data Structures']",https://www.coursera.org/specializations/python-3-programming
Introduction to Financial Accounting,University of Pennsylvania,Business Essentials,"This course is part of multiple programs.
Learn more",4.7,,13 hours to complete,"['Accrual Accounting', 'Income Statement', 'Accounting', 'Balance Sheet', 'Financial Accounting', 'Financial Reporting', 'Financial Statement Analysis', 'Financial Analysis', 'Financial Statements', 'Cash Flows']",https://www.coursera.org/learn/wharton-accounting
Introduction to Cosmetic Science and Ingredients Specialization,Olay,Basic Science,"Learn cosmetic science from Olay scientists. Build a foundational understanding about the industry processes of creating safe and effective cosmetic formulas for skincare, haircare, hygiene cosmetics, color cosmetics, cleansing, and fragrances.",4.7,Beginner level,1 month,"['Product Design', 'Good Manufacturing Practices', 'Feasibility Studies', 'Chemistry', 'Quality Assurance', 'Laboratory Equipment', 'Statistical Process Controls', 'New Product Development', 'Personal Care']",https://www.coursera.org/specializations/introduction-to-cosmetic-science
The Integration of Art and Science in Modern Dental Medicine Specialization,University of Pennsylvania,Patient Care,"Explore the Scope of Dentistry and Oral Health. After completing this specialization, the learner will be able to recognize the scope of dental therapy and identify the relationship between oral and systemic health.",4.9,Intermediate level,1 month,"['Health Assessment', 'Chronic Diseases', 'Dental Care', 'Cardiology', 'Oral and Dental Care', 'Precision Medicine', 'Anatomy', 'Patient Evaluation', 'Oncology', 'Public Health', 'Innovation', 'Dental Procedures']",https://www.coursera.org/specializations/art-and-science-of-dental-medicine
"IBM Deep Learning with PyTorch, Keras and Tensorflow Professional Certificate",IBM,Machine Learning,Fast-track your deep learning engineering career. Build the deep learning expertise employers are looking for in just 3 months,4.4,Intermediate level,2 months,"['Machine Learning Methods', 'Verification And Validation', 'Keras (Neural Network Library)', 'Applied Machine Learning', 'PyTorch (Machine Learning Library)', 'Unsupervised Learning']",https://www.coursera.org/professional-certificates/ibm-deep-learning-with-pytorch-keras-tensorflow
AWS Fundamentals Specialization,Amazon Web Services,Cloud Computing,"Instructors: Alex G.
+3 more",4.7,Beginner level,1 month,"['API Gateway', 'Event-Driven Programming', 'Amazon Elastic Compute Cloud', 'Software Architecture', 'Cloud Computing', 'Amazon S3', 'AWS Identity and Access Management (IAM)', 'Cloud Storage']",https://www.coursera.org/specializations/aws-fundamentals
Microsoft AI & ML Engineering Professional Certificate,Microsoft,Software Development,"Prepare for a Career in AI & ML Engineering. Build, deploy, and innovate with advanced techniques and real-world projects. Intermediate programming knowledge of Python required.",4.6,Intermediate level,6 months,"['Large Language Modeling', 'MLOps (Machine Learning Operations)', 'Applied Machine Learning', 'Unsupervised Learning', 'Application Deployment', 'Microsoft Azure', 'Natural Language Processing']",https://www.coursera.org/professional-certificates/microsoft-ai-and-ml-engineering
"Foundations: Data, Data, Everywhere",Google,Data Analysis,This course is part of Google Data Analytics Professional Certificate,4.8,Beginner level,Flexible schedule,"['Analytical Skills', 'Data Ethics', 'Data Visualization Software', 'Data Visualization', 'Data Sharing', 'Google Sheets', 'Data-Driven Decision-Making', 'Data Analysis', 'Data Cleansing', 'Spreadsheet Software', 'SQL']",https://www.coursera.org/learn/foundations-data
Microsoft 365 Fundamentals Specialization,Microsoft,Business Essentials,Pursue your passion and improve your productivity. Learn how to use the best-in-class suite of apps that help you stay connected and get things done.,4.7,Beginner level,2 months,"['Document Management', 'Microsoft Word', 'Collaborative Software', 'Multimedia', 'File Management', 'Microsoft 365', 'Writing', 'Technical Documentation', 'Proofreading', 'Microsoft PowerPoint', 'Microsoft Windows']",https://www.coursera.org/specializations/microsoft-365-fundamentals
AI Agents in Java with Generative AI Specialization,Vanderbilt University,Machine Learning,Enterprise AI Automation With Java AI Agents. Learn to build powerful AI agents and AI agent architectures in Java that work with nearly any API.,4.8,Beginner level,2 months,"['Java', 'Creative Thinking', 'Brainstorming', 'Collaborative Software', 'Large Language Modeling', 'Agentic systems', 'Productivity', 'ChatGPT', 'OpenAI', 'Prompt Engineering', 'Software Design Documents']",https://www.coursera.org/specializations/ai-agents-java
IBM RAG and Agentic AI Professional Certificate,IBM,Software Development,"Build real-world AI with RAG and agentic AI. Use AI tools to streamline automation, drive innovation & take your career further, faster.",4.6,Advanced level,2 months,"['Full-Stack Web Development', 'Large Language Modeling', 'Agentic systems', 'Flask (Web Framework)', 'OpenAI', 'Software Development', 'Prompt Engineering', 'Database Systems']",https://www.coursera.org/professional-certificates/ibm-rag-and-agentic-ai
Mental Health Care Fundamentals Specialization,MedCerts,Psychology,"Master Mental Health Theories and Development. Gain a thorough understanding of mental health through professional standards, theoretical frameworks, and comprehensive insights into developmental stages, difficulties, and disorders.",4.8,Beginner level,3 months,"['Cultural Diversity', 'Teamwork', 'Professional Development', 'Professionalism', 'Human Development', 'Patient Education And Counseling', 'Mental Health Therapies', 'Cultural Responsiveness', 'Mental Health']",https://www.coursera.org/specializations/mental-health-care-fundamentals
Mergers and Acquisitions Specialization,University of Illinois Urbana-Champaign,Finance,Learn to execute successful M&A strategies. Learners will be able to gain a wholistic understanding of how successful M&A deals are structured and executed to create value for the organization,4.7,Intermediate level,2 months,"['Corporate Accounting', 'Balance Sheet', 'Business Valuation', 'Price Negotiation', 'Financial Management', 'Financial Statement Analysis', 'Accounting', 'Investments', 'Capital Markets', 'Financial Analysis']",https://www.coursera.org/specializations/mergersandacquisitions
Generative AI for Product Managers Specialization,IBM,Leadership and Management,Elevate your Product Manager career with Gen AI. Build in-demand hands-on generative AI skills to boost your Product Manager career in under 2 months. No experience needed to get started,4.5,Intermediate level,3 months,"['Product Lifecycle Management', 'Creativity', 'Large Language Modeling', 'ChatGPT', 'New Product Development', 'OpenAI', 'IBM Cloud', 'Stakeholder Communications', 'Prompt Engineering', 'Team Building']",https://www.coursera.org/specializations/generative-ai-for-product-managers
Meta Full-Stack Developer Specialization,Meta,Mobile and Web Development,Learn and Master Full-Stack Web Development. Master both front-end and back-end skills to build web apps end-to-end,4.8,Beginner level,8 months,"['HTML and CSS', 'Database Design', 'React.js', 'Linux Commands', 'GitHub', 'Database Management Systems', 'Unix Commands', 'SQL', 'Jest (JavaScript Testing Framework)', 'Django (Web Framework)', 'API Design']",https://www.coursera.org/specializations/meta-full-stack-developer
Google Digital Marketing & E-commerce Professional Certificate,Google,Marketing,"Get on the fast track to a career in digital marketing. In this certificate program, you’ll learn in-demand skills, and get AI training from Google experts. Learn at your own pace, no degree or experience required.",4.8,Beginner level,Flexible schedule,"['Interviewing Skills', 'Search Engine Optimization', 'Media Planning', 'Professional Development', 'Campaign Management', 'Performance Measurement', 'Marketing', 'Customer Retention', 'Order Fulfillment']",https://www.coursera.org/professional-certificates/google-digital-marketing-ecommerce
IBM Cybersecurity Analyst Professional Certificate,IBM,Security,Launch your career as a cybersecurity professional. Build job-ready skills and prep for the CompTIA Security+ exam with this program.,4.7,Beginner level,Flexible schedule,"['Cyber Security Assessment', 'Interviewing Skills', 'Identity and Access Management', 'Cyber Threat Hunting', 'Cloud Computing', 'Cybersecurity', 'Intrusion Detection and Prevention']",https://www.coursera.org/professional-certificates/ibm-cybersecurity-analyst
